frame.number$frame.time$frame.len$eth.src$eth.dst$ip.src$ip.dst$ip.proto$ip.len$tcp.len$tcp.srcport$tcp.dstport$_ws.col.Info
1$Feb 13, 2020 21:48:36.307433004 IST$66$98:22:ef:d5:cc:2f$68:ff:7b:9c:eb:36$192.168.0.104$54.71.171.40$6$52$0$58234$443$58234 → 443 [ACK] Seq=1 Ack=1 Win=501 Len=0 TSval=205300104 TSecr=19805546
2$Feb 13, 2020 21:48:36.631488900 IST$66$68:ff:7b:9c:eb:36$98:22:ef:d5:cc:2f$54.71.171.40$192.168.0.104$6$52$0$443$58234$[TCP ACKed unseen segment] 443 → 58234 [ACK] Seq=1 Ack=2 Win=128 Len=0 TSval=19816042 TSecr=205248083
3$Feb 13, 2020 21:48:44.339898314 IST$74$98:22:ef:d5:cc:2f$68:ff:7b:9c:eb:36$192.168.0.104$111.221.29.254$6$60$0$34086$443$34086 → 443 [SYN] Seq=0 Win=64240 Len=0 MSS=1460 SACK_PERM=1 TSval=653574453 TSecr=0 WS=128
4$Feb 13, 2020 21:48:44.381459352 IST$97$68:ff:7b:9c:eb:36$98:22:ef:d5:cc:2f$54.71.171.40$192.168.0.104$6$83$31$443$58234$[TCP ACKed unseen segment] , Encrypted Alert
5$Feb 13, 2020 21:48:44.381574661 IST$97$98:22:ef:d5:cc:2f$68:ff:7b:9c:eb:36$192.168.0.104$54.71.171.40$6$83$31$58234$443$[TCP Previous segment not captured] , Encrypted Alert
6$Feb 13, 2020 21:48:44.384482007 IST$66$98:22:ef:d5:cc:2f$68:ff:7b:9c:eb:36$192.168.0.104$54.71.171.40$6$52$0$58234$443$58234 → 443 [FIN, ACK] Seq=33 Ack=32 Win=501 Len=0 TSval=205308181 TSecr=19823843
7$Feb 13, 2020 21:48:44.444105397 IST$74$68:ff:7b:9c:eb:36$98:22:ef:d5:cc:2f$111.221.29.254$192.168.0.104$6$60$0$443$34086$443 → 34086 [SYN, ACK] Seq=0 Ack=1 Win=8192 Len=0 MSS=1440 WS=256 SACK_PERM=1 TSval=645512368 TSecr=653574453
8$Feb 13, 2020 21:48:44.444138817 IST$66$98:22:ef:d5:cc:2f$68:ff:7b:9c:eb:36$192.168.0.104$111.221.29.254$6$52$0$34086$443$34086 → 443 [ACK] Seq=1 Ack=1 Win=64256 Len=0 TSval=653574557 TSecr=645512368
9$Feb 13, 2020 21:48:44.444277928 IST$583$98:22:ef:d5:cc:2f$68:ff:7b:9c:eb:36$192.168.0.104$111.221.29.254$6$569$517$34086$443$Client Hello
10$Feb 13, 2020 21:48:44.547419222 IST$66$68:ff:7b:9c:eb:36$98:22:ef:d5:cc:2f$111.221.29.254$192.168.0.104$6$52$0$443$34086$443 → 34086 [ACK] Seq=1 Ack=518 Win=263424 Len=0 TSval=645512472 TSecr=653574557
11$Feb 13, 2020 21:48:44.549935899 IST$2962$68:ff:7b:9c:eb:36$98:22:ef:d5:cc:2f$111.221.29.254$192.168.0.104$6$2948$2896$443$34086$[TCP segment of a reassembled PDU]
12$Feb 13, 2020 21:48:44.549951013 IST$66$98:22:ef:d5:cc:2f$68:ff:7b:9c:eb:36$192.168.0.104$111.221.29.254$6$52$0$34086$443$34086 → 443 [ACK] Seq=518 Ack=2897 Win=63104 Len=0 TSval=653574663 TSecr=645512474
13$Feb 13, 2020 21:48:44.550356714 IST$1195$68:ff:7b:9c:eb:36$98:22:ef:d5:cc:2f$111.221.29.254$192.168.0.104$6$1181$1129$443$34086$Server Hello, Certificate, Server Key Exchange, Server Hello Done
14$Feb 13, 2020 21:48:44.550364991 IST$66$98:22:ef:d5:cc:2f$68:ff:7b:9c:eb:36$192.168.0.104$111.221.29.254$6$52$0$34086$443$34086 → 443 [ACK] Seq=518 Ack=4026 Win=64128 Len=0 TSval=653574663 TSecr=645512474
15$Feb 13, 2020 21:48:44.550859208 IST$159$98:22:ef:d5:cc:2f$68:ff:7b:9c:eb:36$192.168.0.104$111.221.29.254$6$145$93$34086$443$Client Key Exchange, Change Cipher Spec, Encrypted Handshake Message
16$Feb 13, 2020 21:48:44.651029313 IST$117$68:ff:7b:9c:eb:36$98:22:ef:d5:cc:2f$111.221.29.254$192.168.0.104$6$103$51$443$34086$Change Cipher Spec, Encrypted Handshake Message
17$Feb 13, 2020 21:48:44.652774298 IST$833$98:22:ef:d5:cc:2f$68:ff:7b:9c:eb:36$192.168.0.104$111.221.29.254$6$819$767$34086$443$Application Data
18$Feb 13, 2020 21:48:44.656996783 IST$78$68:ff:7b:9c:eb:36$98:22:ef:d5:cc:2f$54.71.171.40$192.168.0.104$6$64$0$443$58234$[TCP Dup ACK 2#1] [TCP ACKed unseen segment] 443 → 58234 [ACK] Seq=32 Ack=2 Win=128 Len=0 TSval=19824119 TSecr=205248083 SLE=33 SRE=34
19$Feb 13, 2020 21:48:44.657325550 IST$66$68:ff:7b:9c:eb:36$98:22:ef:d5:cc:2f$54.71.171.40$192.168.0.104$6$52$0$443$58234$443 → 58234 [ACK] Seq=32 Ack=34 Win=128 Len=0 TSval=19824119 TSecr=205308178
20$Feb 13, 2020 21:48:44.657832616 IST$66$68:ff:7b:9c:eb:36$98:22:ef:d5:cc:2f$54.71.171.40$192.168.0.104$6$52$0$443$58234$443 → 58234 [FIN, ACK] Seq=32 Ack=34 Win=128 Len=0 TSval=19824120 TSecr=205308178
21$Feb 13, 2020 21:48:44.657846828 ST|117|68:ff:7b:9c:eb:36|98:22:ef:d5:cc:2f|111.221.29.254|192.168.0.104|6|103|51|443|33610|Change Cipher Spec, Encrypted Handshake Message
23|Feb 13, 2020 19:24:54.287664763 IST|831|98:22:ef:d5:cc:2f|68:ff:7b:9c:eb:36|192.168.0.104|111.221.29.254|6|817|765|33610|443|Application Data
24|Feb 13, 2020 19:24:54.287882722 IST|117|68:ff:7b:9c:eb:36|98:22:ef:d5:cc:2f|111.221.29.254|192.168.0.104|6|103|51|443|33608|Change Cipher Spec, Encrypted Handshake Message
25|Feb 13, 2020 19:24:54.290118220 IST|1121|98:22:ef:d5:cc:2f|68:ff:7b:9c:eb:36|192.168.0.104|111.221.29.254|6|1107|1055|33608|443|Application Data
26|Feb 13, 2020 19:24:54.537505802 IST|66|68:ff:7b:9c:eb:36|98:22:ef:d5:cc:2f|111.221.29.254|192.168.0.104|6|52|0|443|33610|443 → 33610 [ACK] Seq=4077 Ack=1376 Win=262656 Len=0 TSval=2297554069 TSecr=651535010
27|Feb 13, 2020 19:24:54.537531220 IST|66|68:ff:7b:9c:eb:36|98:22:ef:d5:cc:2f|111.221.29.254|192.168.0.104|6|52|0|443|33608|443 → 33608 [ACK] Seq=4077 Ack=1666 Win=262144 Len=0 TSval=2192457167 TSecr=651535013
28|Feb 13, 2020 19:24:54.537537584 IST|380|68:ff:7b:9c:eb:36|98:22:ef:d5:cc:2f|111.221.29.254|192.168.0.104|6|366|314|443|33608|Application Data
29|Feb 13, 2020 19:24:54.537549217 IST|380|68:ff:7b:9c:eb:36|98:22:ef:d5:cc:2f|111.221.29.254|192.168.0.104|6|366|314|443|33610|Application Data
30|Feb 13, 2020 19:24:54.537901509 IST|97|98:22:ef:d5:cc:2f|68:ff:7b:9c:eb:36|192.168.0.104|111.221.29.254|6|83|31|33610|443|Encrypted Alert
31|Feb 13, 2020 19:24:54.537911203 IST|97|98:22:ef:d5:cc:2f|68:ff:7b:9c:eb:36|192.168.0.104|111.221.29.254|6|83|31|33608|443|Encrypted Alert
32|Feb 13, 2020 19:24:54.539461953 IST|66|98:22:ef:d5:cc:2f|68:ff:7b:9c:eb:36|192.168.0.104|111.221.29.254|6|52|0|33608|443|33608 → 443 [FIN, ACK] Seq=1697 Ack=4392 Win=64128 Len=0 TSval=651535262 TSecr=2192457183
33|Feb 13, 2020 19:24:54.539476312 IST|66|98:22:ef:d5:cc:2f|68:ff:7b:9c:eb:36|192.168.0.104|111.221.29.254|6|52|0|33610|443|33610 → 443 [FIN, ACK] Seq=1407 Ack=4392 Win=64128 Len=0 TSval=651535262 TSecr=2297554124
34|Feb 13, 2020 19:24:54.636157205 IST|66|68:ff:7b:9c:eb:36|98:22:ef:d5:cc:2f|111.221.29.254|192.168.0.104|6|52|0|443|33610|[TCP Dup ACK 26#1] 443 → 33610 [ACK] Seq=4392 Ack=1376 Win=262656 Len=0 TSval=2297554257 TSecr=651535010
35|Feb 13, 2020 19:24:54.639352919 IST|66|68:ff:7b:9c:eb:36|98:22:ef:d5:cc:2f|111.221.29.254|192.168.0.104|6|52|0|443|33608|[TCP Dup ACK 27#1] 443 → 33608 [ACK] Seq=4392 Ack=1666 Win=262144 Len=0 TSval=2192457350 TSecr=651535013
36|Feb 13, 2020 19:24:54.639373971 IST|66|68:ff:7b:9c:eb:36|98:22:ef:d5:cc:2f|111.221.29.254|192.168.0.104|6|52|0|443|33610|443 → 33610 [ACK] Seq=4392 Ack=1408 Win=262400 Len=0 TSval=2297554261 TSecr=651535260
37|Feb 13, 2020 19:24:54.642590004 IST|66|68:ff:7b:9c:eb:36|98:22:ef:d5:cc:2f|111.221.29.254|192.168.0.104|6|52|0|443|33608|443 → 33608 [ACK] Seq=4392 Ack=1698 Win=262144 Len=0 TSval=2192457354 TSecr=651535260
38|Feb 13, 2020 19:25:00.724616669 IST|105|98:22:ef:d5:cc:2f|68:ff:7b:9c:eb:36|192.168.0.104|172.217.160.206|6|91|39|60592|443|Application Data
39|Feb 13, 2020 19:25:00.741235173 IST|105|68:ff:7b:9c:eb:36|98:22:ef:d5:cc:2f|172.217.160.206|192.168.0.104|6|91|39|443|60592|Application Data
40|Feb 13, 2020 19:25:00.741254296 IST|66|98:22:ef:d5:cc:2f|68:ff:7b:9c:eb:36|192.168.0.104|172.217.160.206|6|52|0|60592|443|60592 → 443 [ACK] Seq=40 Ack=40 Win=501 Len=0 TSval=3700038200 TSecr=3968799959
41|Feb 13, 2020 19:25:06.879763936 IST|85|98:22:ef:d5:cc:2f|68:ff:7b:9c:eb:36|192.168.0.104|192.168.0.1|17|71||||Standard query 0xf98c A www.google.com OPT
42|Feb 13, 2020 19:25:06.879957693 IST|85|98:22:ef:d5:cc:2f|68:ff:7b:9c:eb:36|192.168.0.104|192.168.0.1|17|71||||Standard query 0x78d5 AAAA www.google.com OPT
43|Feb 13, 2020 19:25:06.892593054 IST|101|68:ff:7b:9c:eb:36|98:22:ef:d5:cc:2f|192.168.0.1|192.168.0.104|17|87||||Standard query response 0xf98c A www.google.com A 172.217.160.196 OPT
44|Feb 13, 2020 19:25:06.892935970 IST|113|68:ff:7b:9c:eb:36|98:22:ef:d5:cc:2f|192.168.0.1|192.168.0.104|17|99||||Standard query response 0x78d5 AAAA www.google.com AAAA 2404:6800:4009:80b::2004 OPT
45|Feb 13, 2020 19:25:06.893045176 IST|74|98:22:ef:d5:cc:2f|68:ff:7b:9c:eb:36|192.168.0.104|172.217.160.196|6|60|0|42218|443|42218 → 443 [SYN] Seq=0 Win=64240 Len=0 MSS=1460 SACK_PERM=1 TSval=3924156628 TSecr=0 WS=128
46|Feb 13, 2020 19:25:06.908358732 IST|74|68:ff:7b:9c:eb:36|98:22:ef:d5:cc:2f|172.217.160.196|192.168.0.104|6|60|0|443|42218|443 → 42218 [SYN, ACK] Seq=0 Ack=1 Win=60192 Len=0 MSS=1380 SACK_PERM=1 TSval=1396797815 TSecr=3924156628 WS=256
47|Feb 13, 2020 19:25:06.908397074 IST|66|98:22:ef:d5:cc:2f|68:ff:7b:9c:eb:36|192.168.0.104|172.217.160.196|6|52|0|42218|443|42218 → 443 [ACK] Seq=1 Ack=1 Win=64256 Len=0 TSval=3924156644 TSecr=1396797815
48|Feb 13, 2020 19:25:06.909357196 IST|704|98:22:ef:d5:cc:2f|68:ff:7b:9c:eb:36|192.168.0.104|172.217.160.196|6|690|638|42218|443|Client Hello
49|Feb 13, 2020 19:25:06.926922570 IST|66|68:ff:7b:9c:eb:36|98:22:ef:d5:cc:2f|172.217.160.196|192.168.0.104|6|52|0|443|42218|443 → 42218 [ACK] Seq=1 Ack=639 Win=61696 Len=0 TSval=1396797834 TSecr=3924156645
50|Feb 13, 2020 19:25:06.928358850 IST|278|68:ff:7b:9c:eb:36|98:22:ef:d5:cc:2f|172.217.160.196|192.168.0.104|6|264|212|443|42218|Server Hello, Change Cipher Spec, Application Data
51|Feb 13, 2020 19:25:06.928371857 IST|66|98:22:ef:d5:cc:2f|68:ff:7b:9c:eb:36|192.168.0.104|172.217.160.196|6|52|0|42218|443|42218 → 443 [ACK] Seq=639 Ack=213 Win=64128 Len=0 TSval=3924156664 TSecr=1396797835
52|Feb 13, 2020 19:25:06.928770275 IST|130|98:22:ef:d5:cc:2f|68:ff:7b:9c:eb:36|192.168.0.104|172.217.160.196|6|116|64|42218|443|Change Cipher Spec, Application Data
53|Feb 13, 2020 19:25:06.929865233 IST|1396|98:22:ef:d5:cc:2f|68:ff:7b:9c:eb:36|192.168.0.104|172.217.160.196|6|1382|1330|42218|443|Application Data, Application Data, Application Data
54|Feb 13, 2020 19:25:06.933059248 IST|258|98:22:ef:d5:cc:2f|68:ff:7b:9c:eb:36|192.168.0.104|172.217.160.196|6|244|192|42218|443|Application Data, Application Data
55|Feb 13, 2020 19:25:06.934573719 IST|218|98:22:ef:d5:cc:2f|68:ff:7b:9c:eb:36|192.168.0.104|172.217.160.196|6|204|152|42218|443|Application Data
56|Feb 13, 2020 19:25:06.936064147 IST|289|98:22:ef:d5:cc:2f|68:ff:7b:9c:eb:36|192.168.0.104|172.217.160.196|6|275|223|42218|443|Application Data, Application Data, Application Data
57|Feb 13, 2020 19:25:06.948174444 IST|66|68:ff:7b:9c:eb:36|98:22:ef:d5:cc:2f|172.217.160.196|192.168.0.104|6|52|0|443|42218|443 → 42218 [ACK] Seq=213 Ack=2033 Win=64256 Len=0 TSval=1396797855 TSecr=3924156664
58|Feb 13, 2020 19:25:06.949697895 IST|646|68:ff:7b:9c:eb:36|98:22:ef:d5:cc:2f|172.217.160.196|192.168.0.104|6|632|580|443|42218|Application Data, Application Data
59|Feb 13, 2020 19:25:06.949866356 IST|97|98:22:ef:d5:cc:2f|68:ff:7b:9c:eb:36|192.168.0.104|172.217.160.196|6|83|31|42218|443|Application Data
60|Feb 13, 2020 19:25:06.950979309 IST|97|68:ff:7b:9c:eb:36|98:22:ef:d5:cc:2f|172.217.160.196|192.168.0.104|6|83|31|443|42218|Application Data
61|Feb 13, 2020 19:25:06.952802044 IST|66|68:ff:7b:9c:eb:36|98:22:ef:d5:cc:2f|172.217.160.196|192.168.0.104|6|52|0|443|42218|443 → 42218 [ACK] Seq=824 Ack=2600 Win=72192 Len=0 TSval=1396797860 TSecr=3924156668
62|Feb 13, 2020 19:25:06.970337716 IST|66|68:ff:7b:9c:eb:36|98:22:ef:d5:cc:2f|172.217.160.196|192.168.0.104|6|52|0|443|42218|443 → 42218 [ACK] Seq=824 Ack=2631 Win=72192 Len=0 TSval=1396797877 TSecr=3924156685
63|Feb 13, 2020 19:25:06.991242712 IST|66|98:22:ef:d5:cc:2f|68:ff:7b:9c:eb:36|192.168.0.104|172.217.160.196|6|52|0|42218|443|42218 → 443 [ACK] Seq=2631 Ack=824 Win=64128 Len=0 TSval=3924156727 TSecr=1396797857
64|Feb 13, 2020 19:25:07.019764593 IST|339|68:ff:7b:9c:eb:36|98:22:ef:d5:cc:2f|172.217.160.196|192.168.0.104|6|325|273|443|42218|Application Data
65|Feb 13, 2020 19:25:07.019830158 IST|66|98:22:ef:d5:cc:2f|68:ff:7b:9c:eb:36|192.168.0.104|172.217.160.196|6|52|0|42218|443|42218 → 443 [ACK] Seq=2631 Ack=1097 Win=64128 Len=0 TSval=3924156755 TSecr=1396797926
66|Feb 13, 2020 19:25:07.019863432 IST|97|68:ff:7b:9c:eb:36|98:22:ef:d5:cc:2f|172.217.160.196|192.168.0.104|6|83|31|443|42218|Application Data
67|Feb 13, 2020 19:25:07.019884166 IST|66|98:22:ef:d5:cc:2f|68:ff:7b:9c:eb:36|192.168.0.104|172.217.160.196|6|52|0|42218|443|42218 → 443 [ACK] Seq=2631 Ack=1128 Win=64128 Len=0 TSval=3924156755 TSecr=1396797926
68|Feb 13, 2020 19:25:07.019895136 IST|105|68:ff:7b:9c:eb:36|98:22:ef:d5:cc:2f|172.217.160.196|192.168.0.104|6|91|39|443|42218|Application Data
69|Feb 13, 2020 19:25:07.019905250 IST|66|98:22:ef:d5:cc:2f|68:ff:7b:9c:eb:36|192.168.0.104|172.217.160.196|6|52|0|42218|443|42218 → 443 [ACK] Seq=2631 Ack=1167 Win=64128 Len=0 TSval=3924156755 TSecr=1396797926
70|Feb 13, 2020 19:25:07.020566982 IST|105|98:22:ef:d5:cc:2f|68:ff:7b:9c:eb:36|192.168.0.104|172.217.160.196|6|91|39|42218|443|Application Data
71|Feb 13, 2020 19:25:07.025462303 IST|132|68:ff:7b:9c:eb:36|98:22:ef:d5:cc:2f|172.217.160.196|192.168.0.104|6|118|66|443|42218|Application Data
72|Feb 13, 2020 19:25:07.025517085 IST|132|68:ff:7b:9c:eb:36|98:22:ef:d5:cc:2f|172.217.160.196|192.168.0.104|6|118|66|443|42218|Application Data
73|Feb 13, 2020 19:25:07.025528304 IST|97|68:ff:7b:9c:eb:36|98:22:ef:d5:cc:2f|172.217.160.196|192.168.0.104|6|83|31|443|42218|Application Data
74|Feb 13, 2020 19:25:07.025535861 IST|97|68:ff:7b:9c:eb:36|98:22:ef:d5:cc:2f|172.217.160.196|192.168.0.104|6|83|31|443|42218|Application Data
75|Feb 13, 2020 19:25:07.026352522 IST|66|98:22:ef:d5:cc:2f|68:ff:7b:9c:eb:36|192.168.0.104|172.217.160.196|6|52|0|42218|443|42218 → 443 [ACK] Seq=2670 Ack=1361 Win=64128 Len=0 TSval=3924156762 TSecr=1396797932
76|Feb 13, 2020 19:25:07.027380422 IST|132|68:ff:7b:9c:eb:36|98:22:ef:d5:cc:2f|172.217.160.196|192.168.0.104|6|118|66|443|42218|Application Data
77|Feb 13, 2020 19:25:07.028819639 IST|97|68:ff:7b:9c:eb:36|98:22:ef:d5:cc:2f|172.217.160.196|192.168.0.104|6|83|31|443|42218|Application Data
78|Feb 13, 2020 19:25:07.028957198 IST|66|98:22:ef:d5:cc:2f|68:ff:7b:9c:eb:36|192.168.0.104|172.217.160.196|6|52|0|42218|443|42218 → 443 [ACK] Seq=2670 Ack=1458 Win=64128 Len=0 TSval=3924156764 TSecr=1396797934
79|Feb 13, 2020 19:25:07.040139568 IST|66|68:ff:7b:9c:eb:36|98:22:ef:d5:cc:2f|172.217.160.196|192.168.0.104|6|52|0|443|42218|443 → 42218 [ACK] Seq=1458 Ack=2670 Win=72192 Len=0 TSval=1396797946 TSecr=3924156756
80|Feb 13, 2020 19:25:07.102672591 IST|218|98:22:ef:d5:cc:2f|68:ff:7b:9c:eb:36|192.168.0.104|172.217.160.196|6|204|152|42218|443|Application Data
81|Feb 13, 2020 19:25:07.107317203 IST|97|98:22:ef:d5:cc:2f|68:ff:7b:9c:eb:36|192.168.0.104|172.217.160.196|6|83|31|42218|443|Application Data
82|Feb 13, 2020 19:25:07.108826457 IST|258|98:22:ef:d5:cc:2f|68:ff:7b:9c:eb:36|192.168.0.104|172.217.160.196|6|244|192|42218|443|Application Data, Application Data
83|Feb 13, 2020 19:25:07.122732863 IST|66|68:ff:7b:9c:eb:36|98:22:ef:d5:cc:2f|172.217.160.196|192.168.0.104|6|52|0|443|42218|443 → 42218 [ACK] Seq=1458 Ack=2822 Win=75008 Len=0 TSval=1396798030 TSecr=3924156838
84|Feb 13, 2020 19:25:07.122989479 IST|66|68:ff:7b:9c:eb:36|98:22:ef:d5:cc:2f|172.217.160.196|192.168.0.104|6|52|0|443|42218|443 → 42218 [ACK] Seq=1458 Ack=3045 Win=77568 Len=0 TSval=1396798030 TSecr=3924156843
85|Feb 13, 2020 19:25:07.193413065 IST|132|68:ff:7b:9c:eb:36|98:22:ef:d5:cc:2f|172.217.160.196|192.168.0.104|6|118|66|443|42218|Application Data
86|Feb 13, 2020 19:25:07.193447222 IST|97|68:ff:7b:9c:eb:36|98:22:ef:d5:cc:2f|172.217.160.196|192.168.0.104|6|83|31|443|42218|Application Data
87|Feb 13, 2020 19:25:07.193703840 IST|66|98:22:ef:d5:cc:2f|68:ff:7b:9c:eb:36|192.168.0.104|172.217.160.196|6|52|0|42218|443|42218 → 443 [ACK] Seq=3045 Ack=1555 Win=64128 Len=0 TSval=3924156929 TSecr=1396798100
88|Feb 13, 2020 19:25:07.194233321 IST|105|68:ff:7b:9c:eb:36|98:22:ef:d5:cc:2f|172.217.160.196|192.168.0.104|6|91|39|443|42218|Application Data
89|Feb 13, 2020 19:25:07.194394285 IST|105|98:22:ef:d5:cc:2f|68:ff:7b:9c:eb:36|192.168.0.104|172.217.160.196|6|91|39|42218|443|Application Data
90|Feb 13, 2020 19:25:07.196877536 IST|132|68:ff:7b:9c:eb:36|98:22:ef:d5:cc:2f|172.217.160.196|192.168.0.104|6|118|66|443|42218|Application Data
91|Feb 13, 2020 19:25:07.196897812 IST|97|68:ff:7b:9c:eb:36|98:22:ef:d5:cc:2f|172.217.160.19645 TSecr=1258022670"
"76","Feb 13, 2020 18:43:58.831273675 IST","66","98:22:ef:d5:cc:2f","68:ff:7b:9c:eb:36","192.168.0.104","23.46.26.99","6","52","0","37680","443","[TCP Dup ACK 16#1] 37680 → 443 [ACK] Seq=1 Ack=1 Win=501 Len=0 TSval=1617452498 TSecr=2704006173"
"77","Feb 13, 2020 18:43:58.831289279 IST","66","98:22:ef:d5:cc:2f","68:ff:7b:9c:eb:36","192.168.0.104","117.18.237.29","6","52","0","47926","80","[TCP Dup ACK 19#1] 47926 → 80 [ACK] Seq=1 Ack=1 Win=501 Len=0 TSval=1396811793 TSecr=1281182716"
"78","Feb 13, 2020 18:43:58.831291465 IST","66","98:22:ef:d5:cc:2f","68:ff:7b:9c:eb:36","192.168.0.104","117.18.237.29","6","52","0","47928","80","[TCP Dup ACK 17#1] 47928 → 80 [ACK] Seq=1 Ack=1 Win=501 Len=0 TSval=1396811793 TSecr=1770111797"
"79","Feb 13, 2020 18:43:58.831292690 IST","66","98:22:ef:d5:cc:2f","68:ff:7b:9c:eb:36","192.168.0.104","117.18.237.29","6","52","0","47924","80","[TCP Dup ACK 18#1] 47924 → 80 [ACK] Seq=1 Ack=1 Win=501 Len=0 TSval=1396811793 TSecr=3043971640"
"80","Feb 13, 2020 18:43:58.873211538 IST","66","68:ff:7b:9c:eb:36","98:22:ef:d5:cc:2f","117.18.237.29","192.168.0.104","6","52","0","80","47926","[TCP Dup ACK 20#1] [TCP ACKed unseen segment] 80 → 47926 [ACK] Seq=1 Ack=2 Win=285 Len=0 TSval=1281192957 TSecr=1396759928"
"81","Feb 13, 2020 18:43:58.878232086 IST","66","68:ff:7b:9c:eb:36","98:22:ef:d5:cc:2f","117.18.237.29","192.168.0.104","6","52","0","80","47928","[TCP Dup ACK 21#1] [TCP ACKed unseen segment] 80 → 47928 [ACK] Seq=1 Ack=2 Win=285 Len=0 TSval=1770122042 TSecr=1396759991"
"82","Feb 13, 2020 18:43:58.883940004 IST","66","68:ff:7b:9c:eb:36","98:22:ef:d5:cc:2f","117.18.237.29","192.168.0.104","6","52","0","80","47924","[TCP Dup ACK 22#1] [TCP ACKed unseen segment] 80 → 47924 [ACK] Seq=1 Ack=2 Win=285 Len=0 TSval=3043981885 TSecr=1396759800"
"83","Feb 13, 2020 18:43:59.019287382 IST","66","68:ff:7b:9c:eb:36","98:22:ef:d5:cc:2f","23.46.26.99","192.168.0.104","6","52","0","443","37680","[TCP Dup ACK 23#1] [TCP ACKed unseen segment] 443 → 37680 [ACK] Seq=1 Ack=2 Win=255 Len=0 TSval=2704016415 TSecr=1617340006"
"84","Feb 13, 2020 18:43:59.087177990 IST","66","98:22:ef:d5:cc:2f","68:ff:7b:9c:eb:36","192.168.0.104","23.46.26.99","6","52","0","37682","443","[TCP Dup ACK 24#1] 37682 → 443 [ACK] Seq=1 Ack=1 Win=501 Len=0 TSval=1617452753 TSecr=2704006437"
"85","Feb 13, 2020 18:43:59.326496951 IST","66","68:ff:7b:9c:eb:36","98:22:ef:d5:cc:2f","23.46.26.99","192.168.0.104","6","52","0","443","37682","[TCP Dup ACK 25#1] [TCP ACKed unseen segment] 443 → 37682 [ACK] Seq=1 Ack=2 Win=255 Len=0 TSval=2704016677 TSecr=1617340340"
"86","Feb 13, 2020 18:44:00.917999895 IST","105","98:22:ef:d5:cc:2f","68:ff:7b:9c:eb:36","192.168.0.104","216.58.196.66","6","91","39","59012","443","Application Data"
"87","Feb 13, 2020 18:44:00.931149154 IST","105","68:ff:7b:9c:eb:36","98:22:ef:d5:cc:2f","216.58.196.66","192.168.0.104","6","91","39","443","59012","Application Data"
"88","Feb 13, 2020 18:44:00.931228534 IST","66","98:22:ef:d5:cc:2f","68:ff:7b:9c:eb:36","192.168.0.104","216.58.196.66","6","52","0","59012","443","59012 → 443 [ACK] Seq=40 Ack=40 Win=501 Len=0 TSval=565938689 TSecr=357242953"
6798274 TSecr=3924157085
110|Feb 13, 2020 19:25:07.495230119 IST|379|98:22:ef:d5:cc:2f|68:ff:7b:9c:eb:36|192.168.0.104|172.217.160.196|6|365|313|42218|443|Application Data
111|Feb 13, 2020 19:25:07.511909743 IST|66|68:ff:7b:9c:eb:36|98:22:ef:d5:cc:2f|172.217.160.196|192.168.0.104|6|52|0|443|42218|443 → 42218 [ACK] Seq=1924 Ack=3811 Win=85504 Len=0 TSval=1396798420 TSecr=3924157231
112|Feb 13, 2020 19:25:07.643977883 IST|413|68:ff:7b:9c:eb:36|98:22:ef:d5:cc:2f|172.217.160.196|192.168.0.104|6|399|347|443|42218|Application Data
113|Feb 13, 2020 19:25:07.644001536 IST|276|68:ff:7b:9c:eb:36|98:22:ef:d5:cc:2f|172.217.160.196|192.168.0.104|6|262|210|443|42218|Application Data
114|Feb 13, 2020 19:25:07.644005740 IST|98|68:ff:7b:9c:eb:36|98:22:ef:d5:cc:2f|172.217.160.196|192.168.0.104|6|84|32|443|42218|Application Data
115|Feb 13, 2020 19:25:07.644014857 IST|66|98:22:ef:d5:cc:2f|68:ff:7b:9c:eb:36|192.168.0.104|172.217.160.196|6|52|0|42218|443|42218 → 443 [ACK] Seq=3811 Ack=2513 Win=64128 Len=0 TSval=3924157379 TSecr=1396798542
116|Feb 13, 2020 19:25:07.644021475 IST|97|68:ff:7b:9c:eb:36|98:22:ef:d5:cc:2f|172.217.160.196|192.168.0.104|6|83|31|443|42218|Application Data
117|Feb 13, 2020 19:25:07.644024381 IST|105|68:ff:7b:9c:eb:36|98:22:ef:d5:cc:2f|172.217.160.196|192.168.0.104|6|91|39|443|42218|Application Data
118|Feb 13, 2020 19:25:07.644254647 IST|66|98:22:ef:d5:cc:2f|68:ff:7b:9c:eb:36|192.168.0.104|172.217.160.196|6|52|0|42218|443|42218 → 443 [ACK] Seq=3811 Ack=2583 Win=64128 Len=0 TSval=3924157380 TSecr=1396798545
119|Feb 13, 2020 19:25:07.644278193 IST|105|98:22:ef:d5:cc:2f|68:ff:7b:9c:eb:36|192.168.0.104|172.217.160.196|6|91|39|42218|443|Application Data
120|Feb 13, 2020 19:25:07.655677132 IST|66|68:ff:7b:9c:eb:36|98:22:ef:d5:cc:2f|172.217.160.196|192.168.0.104|6|52|0|443|42218|443 → 42218 [ACK] Seq=2583 Ack=3850 Win=85504 Len=0 TSval=1396798564 TSecr=3924157380
121|Feb 13, 2020 19:25:07.749658121 IST|349|98:22:ef:d5:cc:2f|68:ff:7b:9c:eb:36|192.168.0.104|172.217.160.196|6|335|283|42218|443|Application Data
122|Feb 13, 2020 19:25:07.765765956 IST|66|68:ff:7b:9c:eb:36|98:22:ef:d5:cc:2f|172.217.160.196|192.168.0.104|6|52|0|443|42218|443 → 42218 [ACK] Seq=2583 Ack=4133 Win=88320 Len=0 TSval=1396798674 TSecr=3924157485
123|Feb 13, 2020 19:25:07.895463465 IST|279|98:22:ef:d5:cc:2f|68:ff:7b:9c:eb:36|192.168.0.104|172.217.160.196|6|265|213|42218|443|Application Data
124|Feb 13, 2020 19:25:07.896972141 IST|273|68:ff:7b:9c:eb:36|98:22:ef:d5:cc:2f|172.217.160.196|192.168.0.104|6|259|207|443|42218|Application Data
125|Feb 13, 2020 19:25:07.896987354 IST|450|68:ff:7b:9c:eb:36|98:22:ef:d5:cc:2f|172.217.160.196|192.168.0.104|6|436|384|443|42218|Application Data
126|Feb 13, 2020 19:25:07.896993558 IST|66|98:22:ef:d5:cc:2f|68:ff:7b:9c:eb:36|192.168.0.104|172.217.160.196|6|52|0|42218|443|42218 → 443 [ACK] Seq=4346 Ack=3174 Win=64128 Len=0 TSval=3924157632 TSecr=1396798795
127|Feb 13, 2020 19:25:07.896998819 IST|98|68:ff:7b:9c:eb:36|98:22:ef:d5:cc:2f|172.217.160.196|192.168.0.104|6|84|32|443|42218|Application Data
128|Feb 13, 2020 19:25:07.897001481 IST|97|68:ff:7b:9c:eb:36|98:22:ef:d5:cc:2f|172.217.160.196|192.168.0.104|6|83|31|443|42218|Application Data
129|Feb 13, 2020 19:25:07.897003668 IST|105|68:ff:7b:9c:eb:36|98:22:ef:d5:cc:2f|172.217.160.196|192.168.0.104|6|91|39|443|42218|Application Data
130|Feb 13, 2020 19:25:07.897103268 IST|66|98:22:ef:d5:cc:2f|68:ff:7b:9c:eb:36|192.168.0.104|172.217.160.196|6|52|0|42218|443|42218 → 443 [ACK] Seq=4346 Ack=3276 Win=64128 Len=0 TSval=3924157632 TSecr=1396798796
131|Feb 13, 2020 19:25:07.897520779 IST|105|98:22:ef:d5:cc:2f|68:ff:7b:9c:eb:36|192.168.0.104|172.217.160.196|6|91|39|42218|443|Application Data
132|Feb 13, 2020 19:25:07.907767118 IST|66|68:ff:7b:9c:eb:36|98:22:ef:d5:cc:2f|172.217.160.196|192.168.0.104|6|52|0|443|42218|443 → 42218 [ACK] Seq=3276 Ack=4346 Win=90880 Len=0 TSval=1396798816 TSecr=3924157631
133|Feb 13, 2020 19:25:07.913697278 IST|66|68:ff:7b:9c:eb:36|98:22:ef:d5:cc:2f|172.217.160.196|192.168.0.104|6|52|0|443|42218|443 → 42218 [ACK] Seq=3276 Ack=4385 Win=90880 Len=0 TSval=1396798822 TSecr=3924157633
134|Feb 13, 2020 19:25:08.014333808 IST|274|68:ff:7b:9c:eb:36|98:22:ef:d5:cc:2f|172.217.160.196|192.168.0.104|6|260|208|443|42218|Application Data
135|Feb 13, 2020 19:25:08.014919376 IST|445|68:ff:7b:9c:eb:36|98:22:ef:d5:cc:2f|172.217.160.196|192.168.0.104|6|431|379|443|42218|Application Data
136|Feb 13, 2020 19:25:08.014932328 IST|66|98:22:ef:d5:cc:2f|68:ff:7b:9c:eb:36|192.168.0.104|172.217.160.196|6|52|0|42218|443|42218 → 443 [ACK] Seq=4385 Ack=3863 Win=64128 Len=0 TSval=3924157750 TSecr=1396798922
137|Feb 13, 2020 19:25:08.015360942 IST|129|68:ff:7b:9c:eb:36|98:22:ef:d5:cc:2f|172.217.160.196|192.168.0.104|6|115|63|443|42218|Application Data, Application Data
138|Feb 13, 2020 19:25:08.015371720 IST|105|68:ff:7b:9c:eb:36|98:22:ef:d5:cc:2f|172.217.160.196|192.168.0.104|6|91|39|443|42218|Application Data
139|Feb 13, 2020 19:25:08.015493254 IST|66|98:22:ef:d5:cc:2f|68:ff:7b:9c:eb:36|192.168.0.104|172.217.160.196|6|52|0|42218|443|42218 → 443 [ACK] Seq=4385 Ack=3965 Win=64128 Len=0 TSval=3924157751 TSecr=1396798922
140|Feb 13, 2020 19:25:08.015542893 IST|105|98:22:ef:d5:cc:2f|68:ff:7b:9c:eb:36|192.168.0.104|172.217.160.196|6|91|39|42218|443|Application Data
141|Feb 13, 2020 19:25:08.027746935 IST|66|68:ff:7b:9c:eb:36|98:22:ef:d5:cc:2f|172.217.160.196|192.168.0.104|6|52|0|443|42218|443 → 42218 [ACK] Seq=3965 Ack=4424 Win=90880 Len=0 TSval=1396798936 TSecr=3924157751
142|Feb 13, 2020 19:25:08.076877593 IST|349|98:22:ef:d5:cc:2f|68:ff:7b:9c:eb:36|192.168.0.104|172.217.160.196|6|335|283|42218|443|Application Data
143|Feb 13, 2020 19:25:08.092173185 IST|66|68:ff:7b:9c:eb:36|98:22:ef:d5:cc:2f|172.217.160.196|192.168.0.104|6|52|0|443|42218|443 → 42218 [ACK] Seq=3965 Ack=4707 Win=93696 Len=0 TSval=1396799000 TSecr=3924157812
144|Feb 13, 2020 19:25:08.258399159 IST|274|68:ff:7b:9c:eb:36|98:22:ef:d5:cc:2f|172.217.160.196|192.168.0.104|6|260|208|443|42218|Application Data
145|Feb 13, 2020 19:25:08.258422204 IST|463|68:ff:7b:9c:eb:36|98:22:ef:d5:cc:2f|172.217.160.196|192.168.0.104|6|449|397|443|42218|Application Data
146|Feb 13, 2020 19:25:08.258436091 IST|66|98:22:ef:d5:cc:2f|68:ff:7b:9c:eb:36|192.168.0.104|172.217.160.196|6|52|0|42218|443|42218 → 443 [ACK] Seq=4707 Ack=4570 Win=64128 Len=0 TSval=3924157994 TSecr=1396799115
147|Feb 13, 2020 19:25:08.258444906 IST|129|68:ff:7b:9c:eb:36|98:22:ef:d5:cc:2f|172.217.160.196|192.168.0.104|6|115|63|443|42218|Application Data, Application Data
148|Feb 13, 2020 19:25:08.258447833 IST|105|68:ff:7b:9c:eb:36|98:22:ef:d5:cc:2f|172.217.160.196|192.168.0.104|6|91|39|443|42218|Application Data
149|Feb 13, 2020 19:25:08.258450924 IST|105|68:ff:7b:9c:eb:36|98:22:ef:d5:cc:2f|172.217.160.196|192.168.0.104|6|91|39|443|42218|[TCP Retransmission] 443 → 42218 [PSH, ACK] Seq=4633 Ack=4707 Win=93696 Len=39 TSval=1396799155 TSecr=3924157812
150|Feb 13, 2020 19:25:08.258455145 IST|78|98:22:ef:d5:cc:2f|68:ff:7b:9c:eb:36|192.168.0.104|172.217.160.196|6|64|0|42218|443|42218 → 443 [ACK] Seq=4707 Ack=4672 Win=64128 Len=0 TSval=3924157994 TSecr=1396799115 SLE=4633 SRE=4672
151|Feb 13, 2020 19:25:08.258636704 IST|105|98:22:ef:d5:cc:2f|68:ff:7b:9c:eb:36|192.168.0.104|172.217.160.196|6|91|39|42218|443|Application Data
152|Feb 13, 2020 19:25:08.274250065 IST|66|68:ff:7b:9c:eb:36|98:22:ef:d5:cc:2f|172.217.160.196|192.168.0.104|6|52|0|443|42218|443 → 42218 [ACK] Seq=4672 Ack=4746 Win=93696 Len=0 TSval=1396799182 TSecr=3924157994
153|Feb 13, 2020 19:25:08.568005119 IST|351|98:22:ef:d5:cc:2f|68:ff:7b:9c:eb:36|192.168.0.104|172.217.160.196|6|337|285|42218|443|Application Data
154|Feb 13, 2020 19:25:08.585378509 IST|66|68:ff:7b:9c:eb:36|98:22:ef:d5:cc:2f|172.217.160.196|192.168.0.104|6|52|0|443|42218|443 → 42218 [ACK] Seq=4672 Ack=5031 Win=96256 Len=0 TSval=1396799492 TSecr=3924158303
                                                                                                                                                                                                                                                                                                                                                                                                                                                                                                                                                                                                                                                                                                                                                                                                                                                                                                                                                                                                                                                                                                                                                                                                                                                                                                                                                                                                                                                                                                                                                                                                                                                                                                                                                                                                                                                                                                                                                                                                                                                                                                                                                                                                                                                                                                                                                                                                                                                                                                                                                                                                                                                                                                                                                                                                                                                                                                                                                                                                                                                                                                                                                                                                                                                                                                                                                                                                                                                                                                                                                                                                                                                                                                                                                                                                                                                                                                                                                                                                                                                                                                                                                                                                                                                                                                                                                                                                                                                                                                                                                                                                                                                                                                                                                                                                                                                                                                                                                                                                                                                                                                                                                                                                                                                                                                                                                                                                                                                                                                                        :eb:36$98:22:ef:d5:cc:2f$40.77.226.250$192.168.0.104$6$52$0$443$36908$443 → 36908 [ACK] Seq=4392 Ack=1625 Win=262400 Len=0 TSval=2222823254 TSecr=2949642911
173$Feb 13, 2020 21:35:01.191538228 IST$154$30:57:14:32:da:f1$01:00:5e:00:00:fb$192.168.0.103$224.0.0.251$17$140$$$$Standard query 0x0000 PTR _homekit._tcp.local, "QM" question PTR _companion-link._tcp.local, "QM" question PTR _sleep-proxy._udp.local, "QM" question OPT
174$Feb 13, 2020 21:35:04.264778904 IST$42$68:ff:7b:9c:eb:36$98:22:ef:d5:cc:2f$$$$$$$$Who has 192.168.0.104? Tell 192.168.0.1
175$Feb 13, 2020 21:35:04.264794099 IST$42$98:22:ef:d5:cc:2f$68:ff:7b:9c:eb:36$$$$$$$$192.168.0.104 is at 98:22:ef:d5:cc:2f
176$Feb 13, 2020 21:35:08.088073900 IST$100$98:22:ef:d5:cc:2f$68:ff:7b:9c:eb:36$192.168.0.104$192.168.0.1$17$86$$$$Standard query 0x549b A pagead2.googlesyndication.com OPT
177$Feb 13, 2020 21:35:08.088237169 IST$100$98:22:ef:d5:cc:2f$68:ff:7b:9c:eb:36$192.168.0.104$192.168.0.1$17$86$$$$Standard query 0xb452 AAAA pagead2.googlesyndication.com OPT
178$Feb 13, 2020 21:35:08.100759976 IST$156$68:ff:7b:9c:eb:36$98:22:ef:d5:cc:2f$192.168.0.1$192.168.0.104$17$142$$$$Standard query response 0x549b A pagead2.googlesyndication.com CNAME pagead46.l.doubleclick.net A 172.217.27.194 OPT
179$Feb 13, 2020 21:35:08.100785592 IST$168$68:ff:7b:9c:eb:36$98:22:ef:d5:cc:2f$192.168.0.1$192.168.0.104$17$154$$$$Standard query response 0xb452 AAAA pagead2.googlesyndication.com CNAME pagead46.l.doubleclick.net AAAA 2404:6800:4009:800::2002 OPT
180$Feb 13, 2020 21:35:08.101492742 IST$74$98:22:ef:d5:cc:2f$68:ff:7b:9c:eb:36$192.168.0.104$172.217.27.194$6$60$0$39756$443$39756 → 443 [SYN] Seq=0 Win=64240 Len=0 MSS=1460 SACK_PERM=1 TSval=966641847 TSecr=0 WS=128
181$Feb 13, 2020 21:35:08.117141739 IST$74$68:ff:7b:9c:eb:36$98:22:ef:d5:cc:2f$172.217.27.194$192.168.0.104$6$60$0$443$39756$443 → 39756 [SYN, ACK] Seq=0 Ack=1 Win=60192 Len=0 MSS=1380 SACK_PERM=1 TSval=3198858955 TSecr=966641847 WS=256
182$Feb 13, 2020 21:35:08.117175235 IST$66$98:22:ef:d5:cc:2f$68:ff:7b:9c:eb:36$192.168.0.104$172.217.27.194$6$52$0$39756$443$39756 → 443 [ACK] Seq=1 Ack=1 Win=64256 Len=0 TSval=966641862 TSecr=3198858955
183$Feb 13, 2020 21:35:08.118084994 IST$583$98:22:ef:d5:cc:2f$68:ff:7b:9c:eb:36$192.168.0.104$172.217.27.194$6$569$517$39756$443$Client Hello
184$Feb 13, 2020 21:35:08.138045037 IST$66$68:ff:7b:9c:eb:36$98:22:ef:d5:cc:2f$172.217.27.194$192.168.0.104$6$52$0$443$39756$443 → 39756 [ACK] Seq=1 Ack=518 Win=61440 Len=0 TSval=3198858976 TSecr=966641863
185$Feb 13, 2020 21:35:08.200559978 IST$2937$68:ff:7b:9c:eb:36$98:22:ef:d5:cc:2f$172.217.27.194$192.168.0.104$6$2923$2871$443$39756$Server Hello, Change Cipher Spec, Application Data
186$Feb 13, 2020 21:35:08.200632828 IST$66$98:22:ef:d5:cc:2f$68:ff:7b:9c:eb:36$192.168.0.104$172.217.27.194$6$52$0$39756$443$39756 → 443 [ACK] Seq=518 Ack=2872 Win=61952 Len=0 TSval=966641946 TSecr=3198859037
187$Feb 13, 2020 21:35:08.206148614 IST$130$98:22:ef:d5:cc:2f$68:ff:7b:9c:eb:36$192.168.0.104$172.217.27.194$6$116$64$39756$443$Change Cipher Spec, Application Data
188$Feb 13, 2020 21:35:08.209358320 IST$941$98:22:ef:d5:cc:2f$68:ff:7b:9c:eb:36$192.168.0.104$172.217.27.194$6$927$875$39756$443$Application Data, Application Data
189$Feb 13, 2020 21:35:08.222083364 IST$66$68:ff:7b:9c:eb:36$98:22:ef:d5:cc:2f$172.217.27.194$192.168.0.104$6$52$0$443$39756$443 → 39756 [ACK] Seq=2872 Ack=582 Win=61440 Len=0 TSval=3198859059 TSecr=966641951
190$Feb 13, 2020 21:35:08.222136624 IST$128$68:ff:7b:9c:eb:36$98:22:ef:d5:cc:2f$172.217.27.194$192.168.0.104$6$114$62$443$39756$Application Data
191$Feb 13, 2020 21:35:08.222369962 IST$97$98:22:ef:d5:cc:2f$68:ff:7b:9c:eb:36$192.168.0.104$172.217.27.194$6$83$31$39756$443$Application Data
192$Feb 13, 2020 21:35:08.226696810 IST$97$68:ff:7b:9c:eb:36$98:22:ef:d5:cc:2f$172.217.27.194$192.168.0.104$6$83$31$443$39756$Application Data
193$Feb 13, 2020 21:35:08.240730121 IST$66$68:ff:7b:9c:eb:36$98:22:ef:d5:cc:2f$172.217.27.194$192.168.0.104$6$52$0$443$39756$443 → 39756 [ACK] Seq=2965 Ack=1488 Win=63232 Len=0 TSval=3198859079 TSecr=966641968
194$Feb 13, 2020 21:35:08.267396686 IST$66$98:22:ef:d5:cc:2f$68:ff:7b:9c:eb:36$192.168.0.104$172.217.27.194$6$52$0$39756$443$39756 → 443 [ACK] Seq=1488 Ack=2965 Win=64128 Len=0 TSval=966642013 TSecr=3198859064
195$Feb 13, 2020 21:35:08.286131361 IST$750$68:ff:7b:9c:eb:36$98:22:ef:d5:cc:2f$172.217.27.194$192.168.0.104$6$736$684$443$39756$Application Data
196$Feb 13, 2020 21:35:08.286196174 IST$66$98:22:ef:d5:cc:2f$68:ff:7b:9c:eb:36$192.168.0.104$172.217.27.194$6$52$0$39756$443$39756 → 443 [ACK] Seq=1488 Ack=3649 Win=64128 Len=0 TSval=966642031 TSecr=3198859125
197$Feb 13, 2020 21:35:08.286226606 IST$139$68:ff:7b:9c:eb:36$98:22:ef:d5:cc:2f$172.217.27.194$192.168.0.104$6$125$73$443$39756$Application Data
198$Feb 13, 2020 21:35:08.286245941 IST$66$98:22:ef:d5:cc:2f$68:ff:7b:9c:eb:36$192.168.0.104$172.217.27.194$6$52$0$39756$443$39756 → 443 [ACK] Seq=1488 Ack=3722 Win=64128 Len=0 TSval=966642031 TSecr=3198859125
199$Feb 13, 2020 21:35:08.287914252 IST$97$68:ff:7b:9c:eb:36$98:22:ef:d5:cc:2f$172.217.27.194$192.168.0.104$6$83$31$443$39756$Application Data
200$Feb 13, 2020 21:35:08.287960712 IST$66$98:22:ef:d5:cc:2f$68:ff:7b:9c:eb:36$192.168.0.104$172.217.27.194$6$52$0$39756$443$39756 → 443 [ACK] Seq=1488 Ack=3753 Win=64128 Len=0 TSval=966642033 TSecr=3198859127
201$Feb 13, 2020 21:35:08.287993500 IST$105$68:ff:7b:9c:eb:36$98:22:ef:d5:cc:2f$172.217.27.194$192.168.0.104$6$91$39$443$39756$Application Data
202$Feb 13, 2020 21:35:08.288011791 IST$66$98:22:ef:d5:cc:2f$68:ff:7b:9c:eb:36$192.168.0.104$172.217.27.194$6$52$0$39756$443$39756 → 443 [ACK] Seq=1488 Ack=3792 Win=64128 Len=0 TSval=966642033 TSecr=3198859127
203$Feb 13, 2020 21:35:08.288334870 IST$105$98:22:ef:d5:cc:2f$68:ff:7b:9c:eb:36$192.168.0.104$172.217.27.194$6$91$39$39756$443$Application Data
204$Feb 13, 2020 21:35:08.304182377 IST$66$68:ff:7b:9c:eb:36$98:22:ef:d5:cc:2f$172.217.27.194$192.168.0.104$6$52$0$443$39756$443 → 39756 [ACK] Seq=3792 Ack=1527 Win=63232 Len=0 TSval=3198859143 TSecr=966642034
205$Feb 13, 2020 21:35:10.203045213 IST$154$30:57:14:32:da:f1$01:00:5e:00:00:fb$192.168.0.103$224.0.0.251$17$140$$$$Standard query 0x0000 PTR _homekit._tcp.local, "QM" question PTR _companion-link._tcp.local, "QM" question PTR _sleep-proxy._udp.local, "QM" question OPT
206$Feb 13, 2020 21:35:15.015952696 IST$103$c0:ee:fb:55:67:a9$01:00:5e:00:00:fb$192.168.0.101$224.0.0.251$17$89$$$$Standard query 0x0001 PTR _37F83649._sub._googlecast._tcp.local, "QU" question PTR _googlecast._tcp.local, "QU" question
207$Feb 13, 2020 21:35:15.682842113 IST$114$98:22:ef:d5:cc:2f$68:ff:7b:9c:eb:36$192.168.0.104$192.168.0.1$17$100$$$$Standard query 0xed34 A asimov.vortex.data.microsoft.com.akadns.net OPT
208$Feb 13, 2020 21:35:15.683042407 IST$114$98:22:ef:d5:cc:2f$68:ff:7b:9c:eb:36$192.168.0.104$192.168.0.1$17$100$$$$Standard query 0xf38b AAAA asimov.vortex.data.microsoft.com.akadns.net OPT
209$Feb 13, 2020 21:35:15.696476942 IST$166$68:ff:7b:9c:eb:36$98:22:ef:d5:cc:2f$192.168.0.1$192.168.0.104$17$152$$$$Standard query response 0xed34 A asimov.vortex.data.microsoft.com.akadns.net CNAME geo.vortex.data.microsoft.com.akadns.net CNAME hk2.vortex.data.microsoft.com.akadns.net A 111.221.29.254 OPT
210$Feb 13, 2020 21:35:15.696505829 IST$216$68:ff:7b:9c:eb:36$98:22:ef:d5:cc:2f$192.168.0.1$192.168.0.104$17$202$$$$Standard query response 0xf38b AAAA asimov.vortex.data.microsoft.com.akadns.net CNAME geo.vortex.data.microsoft.com.akadns.net CNAME hk2.vortex.data.microsoft.com.akadns.net SOA internal.akadns.net OPT
211$Feb 13, 2020 21:35:15.697325123 IST$74$98:22:ef:d5:cc:2f$68:ff:7b:9c:eb:36$192.168.0.104$111.221.29.254$6$60$0$33862$443$33862 → 443 [SYN] Seq=0 Win=64240 Len=0 MSS=1460 SACK_PERM=1 TSval=652765831 TSecr=0 WS=128
212$Feb 13, 2020 21:35:15.836502866 IST$74$68:ff:7b:9c:eb:36$98:22:ef:d5:cc:2f$111.221.29.254$192.168.0.104$6$60$0$443$33862$443 → 33862 [SYN, ACK] Seq=0 Ack=1 Win=8192 Len=0 MSS=1440 WS=256 SACK_PERM=1 TSval=1242481509 TSecr=652765831
213$Feb 13, 2020 21:35:15.836606378 IST$66$98:22:ef:d5:cc:2f$68:ff:7b:9c:eb:36$192.168.0.104$111.221.29.254$6$52$0$33862$443$33862 → 443 [ACK] Seq=1 Ack=1 Win=64256 Len=0 TSval=652765971 TSecr=1242481509
214$Feb 13, 2020 21:35:15.837176967 IST$583$98:22:ef:d5:cc:2f$68:ff:7b:9c:eb:36$192.168.0.104$111.221.29.254$6$569$517$33862$443$Client Hello
215$Feb 13, 2020 21:35:16.042229536 IST$4091$68:ff:7b:9c:eb:36$98:22:ef:d5:cc:2f$111.221.29.254$192.168.0.104$6$4077$4025$443$33862$Server Hello, Certificate, Server Key Exchange, Server Hello Done
216$Feb 13, 2020 21:35:16.042322435 IST$66$98:22:ef:d5:cc:2f$68:ff:7b:9c:eb:36$192.168.0.104$111.221.29.254$6$52$0$33862$443$33862 → 443 [ACK] Seq=518 Ack=4026 Win=61952 Len=0 TSval=652766176 TSecr=1242481655
217$Feb 13, 2020 21:35:16.044278283 IST$159$98:22:ef:d5:cc:2f$68:ff:7b:9c:eb:36$192.168.0.104$111.221.29.254$6$145$93$33862$443$Client Key Exchange, Change Cipher Spec, Encrypted Handshake Message
218$Feb 13, 2020 21:35:16.144452906 IST$117$68:ff:7b:9c:eb:36$98:22:ef:d5:cc:2f$111.221.29.254$192.168.0.104$6$103$51$443$33862$Change Cipher Spec, Encrypted Handshake Message
219$Feb 13, 2020 21:35:16.146746507 IST$1494$98:22:ef:d5:cc:2f$68:ff:7b:9c:eb:36$192.168.0.104$111.221.29.254$6$1480$1428$33862$443$[TCP segment of a reassembled PDU]
220$Feb 13, 2020 21:35:16.151766986 IST$154$98:22:ef:d5:cc:2f$68:ff:7b:9c:eb:36$192.168.0.104$111.221.29.254$6$140$88$33862$443$Application Data
221$Feb 13, 2020 21:35:16.256053635 IST$66$68:ff:7b:9c:eb:36$98:22:ef:d5:cc:2f$111.221.29.254$192.168.0.104$6$52$0$443$33862$443 → 33862 [ACK] Seq=4077 Ack=2127 Win=263424 Len=0 TSval=1242481966 TSecr=652766281
222$Feb 13, 2020 21:35:16.348822514 IST$380$68:ff:7b:9c:eb:36$98:22:ef:d5:cc:2f$111.221.29.254$192.168.0.104$6$366$314$443$33862$Application Data
223$Feb 13, 2020 21:35:16.349284786 IST$97$98:22:ef:d5:cc:2f$68:ff:7b:9c:eb:36$192.168.0.104$111.221.29.254$6$83$31$33862$443$Encrypted Alert
224$Feb 13, 2020 21:35:16.350782338 IST$66$98:22:ef:d5:cc:2f$68:ff:7b:9c:eb:36$192.168.0.104$111.221.29.254$6$52$0$33862$443$33862 → 443 [FIN, ACK] Seq=2158 Ack=4392 Win=64128 Len=0 TSval=652766485 TSecr=1242482008
225$Feb 13, 2020 21:35:16.453916949 IST$66$68:ff:7b:9c:eb:36$98:22:ef:d5:cc:2f$111.221.29.254$192.168.0.104$6$52$0$443$33862$443 → 33862 [ACK] Seq=4392 Ack=2159 Win=263424 Len=0 TSval=1242482165 TSecr=652766483
226$Feb 13, 2020 22:09:13.299383218 IST$66$98:22:ef:d5:cc:2f$68:ff:7b:9c:eb:36$192.168.0.104$91.189.92.41$6$52$0$45012$443$45012 → 443 [ACK] Seq=1 Ack=1 Win=501 Len=0 TSval=567977 TSecr=903437462
227$Feb 13, 2020 22:09:13.519727829 IST$66$68:ff:7b:9c:eb:36$98:22:ef:d5:cc:2f$91.189.92.41$192.168.0.104$6$52$0$443$45012$[TCP ACKed unseen segment] 443 → 45012 [ACK] Seq=1 Ack=2 Win=235 Len=0 TSval=903445201 TSecr=537204
228$Feb 13, 2020 22:09:13.531421850 IST$66$98:22:ef:d5:cc:2f$68:ff:7b:9c:eb:36$192.168.0.104$91.189.92.41$6$52$0$45010$443$45010 → 443 [ACK] Seq=1 Ack=1 Win=2424 Len=0 TSval=568209 TSecr=903437725
229$Feb 13, 2020 22:09:13.724602397 IST$66$68:ff:7b:9c:eb:36$98:22:ef:d5:cc:2f$91.189.92.41$192.168.0.104$6$52$0$443$45010$[TCP ACKed unseen segment] 443 → 45010 [ACK] Seq=1 Ack=2 Win=299 Len=0 TSval=903445259 TSecr=538209
230$Feb 13, 2020 22:09:15.211854960 IST$99$98:22:ef:d5:cc:2f$68:ff:7b:9c:eb:36$192.168.0.104$192.168.0.1$17$85$$$$Standard query 0x567f A dc.services.visualstudio.com OPT
231$Feb 13, 2020 22:09:15.211947964 IST$99$98:22:ef:d5:cc:2f$68:ff:7b:9c:eb:36$192.168.0.104$192.168.0.1$17$85$$$$Standard query 0x6bce AAAA dc.services.visualstudio.com OPT
232$Feb 13, 2020 22:09:15.226043705 IST$237$68:ff:7b:9c:eb:36$98:22:ef:d5:cc:2f$192.168.0.1$192.168.0.104$17$223$$$$Standard query response 0x567f A dc.services.visualstudio.com CNAME dc.applicationinsights.microsoft.com CNAME dc.trafficmanager.net CNAME cin-breeziest-in.cloudapp.net A 104.211.92.54 OPT
233$Feb 13, 2020 22:09:15.226070487 IST$284$68:ff:7b:9c:eb:36$98:22:ef:d5:cc:2f$192.168.0.1$192.168.0.104$17$270$$$$Standard query response 0x6bce AAAA dc.services.visualstudio.com CNAME dc.applicationinsights.microsoft.com CNAME dc.trafficmanager.net CNAME cin-breeziest-in.cloudapp.net SOA prd1.azuredns-cloud.net OPT
234$Feb 13, 2020 22:09:15.226807582 IST$100$98:22:ef:d5:cc:2f$68:ff:7b:9c:eb:36$192.168.0.104$192.168.0.1$17$86$$$$Standard query 0xb039 AAAA cin-breeziest-in.cloudapp.net OPT
235$Feb 13, 2020 22:09:15.372165899 IST$176$68:ff:7b:9c:eb:36$98:22:ef:d5:cc:2f$192.168.0.1$192.168.0.104$17$162$$$$Standard query response 0xb039 AAAA cin-breeziest-in.cloudapp.net SOA prd1.azuredns-cloud.net OPT
236$Feb 13, 2020 22:09:15.373272601 IST$74$98:22:ef:d5:cc:2f$68:ff:7b:9c:eb:36$192.168.0.104$104.211.92.54$6$60$0$38474$443$38474 → 443 [SYN] Seq=0 Win=64240 Len=0 MSS=1460 SACK_PERM=1 TSval=3682394943 TSecr=0 WS=128
237$Feb 13, 2020 22:09:15.390450122 IST$74$68:ff:7b:9c:eb:36$98:22:ef:d5:cc:2f$104.211.92.54$192.168.0.104$6$60$0$443$38474$443 → 38474 [SYN, ACK] Seq=0 Ack=1 Win=8192 Len=0 MSS=1440 WS=256 SACK_PERM=1 TSval=306595510 TSecr=3682394943
238$Feb 13, 2020 22:09:15.390481620 IST$66$98:22:ef:d5:cc:2f$68:ff:7b:9c:eb:36$192.168.0.104$104.211.92.54$6$52$0$38474$443$38474 → 443 [ACK] Seq=1 Ack=1 Win=64256 Len=0 TSval=3682394961 TSecr=306595510
239$Feb 13, 2020 22:09:15.390789536 IST$583$98:22:ef:d5:cc:2f$68:ff:7b:9c:eb:36$192.168.0.104$104.211.92.54$6$569$517$38474$443$Client Hello
240$Feb 13, 2020 22:09:15.417165010 IST$5042$68:ff:7b:9c:eb:36$98:22:ef:d5:cc:2f$104.211.92.54$192.168.0.104$6$5028$4976$443$38474$Server Hello, Certificate, Server Key Exchange, Server Hello Done
241$Feb 13, 2020 22:09:15.417197814 IST$66$98:22:ef:d5:cc:2f$68:ff:7b:9c:eb:36$192.168.0.104$104.211.92.54$6$52$0$38474$443$38474 → 443 [ACK] Seq=518 Ack=4977 Win=60672 Len=0 TSval=3682394987 TSecr=306595534
242$Feb 13, 2020 22:09:15.418240763 IST$216$98:22:ef:d5:cc:2f$68:ff:7b:9c:eb:36$192.168.0.104$104.211.92.54$6$202$150$38474$443$Client Key Exchange, Change Cipher Spec, Encrypted Handshake Message
243$Feb 13, 2020 22:09:15.447747738 IST$66$68:ff:7b:9c:eb:36$98:22:ef:d5:cc:2f$104.211.92.54$192.168.0.104$6$52$0$443$38474$443 → 38474 [ACK] Seq=4977 Ack=668 Win=263168 Len=0 TSval=306595566 TSecr=3682394988
244$Feb 13, 2020 22:09:15.447768583 IST$141$68:ff:7b:9c:eb:36$98:22:ef:d5:cc:2f$104.211.92.54$192.168.0.104$6$127$75$443$38474$Change Cipher Spec, Encrypted Handshake Message
245$Feb 13, 2020 22:09:15.449353750 IST$247$98:22:ef:d5:cc:2f$68:ff:7b:9c:eb:36$192.168.0.104$104.211.92.54$6$233$181$38474$443$Application Data
246$Feb 13, 2020 22:09:15.492490158 IST$567$68:ff:7b:9c:eb:36$98:22:ef:d5:cc:2f$104.211.92.54$192.168.0.104$6$553$501$443$38474$Application Data
247$Feb 13, 2020 22:09:15.493895022 IST$66$98:22:ef:d5:cc:2f$68:ff:7b:9c:eb:36$192.168.0.104$104.211.92.54$6$52$0$38474$443$38474 → 443 [FIN, ACK] Seq=849 Ack=5554 Win=64128 Len=0 TSval=3682395064 TSecr=306595609
248$Feb 13, 2020 22:09:15.514201579 IST$66$68:ff:7b:9c:eb:36$98:22:ef:d5:cc:2f$104.211.92.54$192.168.0.104$6$52$0$443$38474$443 → 38474 [ACK] Seq=5554 Ack=850 Win=263168 Len=0 TSval=306595630 TSecr=3682395064
249$Feb 13, 2020 22:09:15.978458432 IST$74$98:22:ef:d5:cc:2f$68:ff:7b:9c:eb:36$192.168.0.104$104.211.92.54$6$60$0$38476$443$38476 → 443 [SYN] Seq=0 Win=64240 Len=0 MSS=1460 SACK_PERM=1 TSval=3682395549 TSecr=0 WS=128
250$Feb 13, 2020 22:09:15.998192360 IST$74$68:ff:7b:9c:eb:36$98:22:ef:d5:cc:2f$104.211.92.54$192.168.0.104$6$60$0$443$38476$443 → 38476 [SYN, ACK] Seq=0 Ack=1 Win=8192 Len=0 MSS=1440 WS=256 SACK_PERM=1 TSval=70209375 TSecr=3682395549
251$Feb 13, 2020 22:09:15.998236502 IST$66$98:22:ef:d5:cc:2f$68:ff:7b:9c:eb:36$192.168.0.104$104.211.92.54$6$52$0$38476$443$38476 → 443 [ACK] Seq=1 Ack=1 Win=64256 Len=0 TSval=3682395568 TSecr=70209375
252$Feb 13, 2020 22:09:16.004652556 IST$583$98:22:ef:d5:cc:2f$68:ff:7b:9c:eb:36$192.168.0.104$104.211.92.54$6$569$517$38476$443$Client Hello
253$Feb 13, 2020 22:09:16.027276005 IST$5042$68:ff:7b:9c:eb:36$98:22:ef:d5:cc:2f$104.211.92.54$192.168.0.104$6$5028$4976$443$38476$Server Hello, Certificate, Server Key Exchange, Server Hello Done
254$Feb 13, 2020 22:09:16.027303466 IST$66$98:22:ef:d5:cc:2f$68:ff:7b:9c:eb:36$192.168.0.104$104.211.92.54$6$52$0$38476$443$38476 → 443 [ACK] Seq=518 Ack=4977 Win=60672 Len=0 TSval=3682395597 TSecr=70209397
255$Feb 13, 2020 22:09:16.031256706 IST$216$98:22:ef:d5:cc:2f$68:ff:7b:9c:eb:36$192.168.0.104$104.211.92.54$6$202$150$38476$443$Client Key Exchange, Change Cipher Spec, Encrypted Handshake Message
256$Feb 13, 2020 22:09:16.048821775 IST$141$68:ff:7b:9c:eb:36$98:22:ef:d5:cc:2f$104.211.92.54$192.168.0.104$6$127$75$443$38476$Change Cipher Spec, Encrypted Handshake Message
257$Feb 13, 2020 22:09:16.050615167 IST$247$98:22:ef:d5:cc:2f$68:ff:7b:9c:eb:36$192.168.0.104$104.211.92.54$6$233$181$38476$443$Application Data
258$Feb 13, 2020 22:09:16.075262028 IST$567$68:ff:7b:9c:eb:36$98:22:ef:d5:cc:2f$104.211.92.54$192.168.0.104$6$553$501$443$38476$Application Data
259$Feb 13, 2020 22:09:16.077237706 IST$66$98:22:ef:d5:cc:2f$68:ff:7b:9c:eb:36$192.168.0.104$104.211.92.54$6$52$0$38476$443$38476 → 443 [FIN, ACK] Seq=849 Ack=5554 Win=64128 Len=0 TSval=3682395647 TSecr=70209452
260$Feb 13, 2020 22:09:16.096964587 IST$66$68:ff:7b:9c:eb:36$98:22:ef:d5:cc:2f$104.211.92.54$192.168.0.104$6$52$0$443$38476$443 → 38476 [ACK] Seq=5554 Ack=850 Win=263168 Len=0 TSval=70209474 TSecr=3682395647
261$Feb 13, 2020 22:09:16.895744290 IST$99$98:22:ef:d5:cc:2f$68:ff:7b:9c:eb:36$192.168.0.104$192.168.0.1$17$85$$$$Standard query 0x7159 A marketplace.visualstudio.com OPT
262$Feb 13, 2020 22:09:16.906429525 IST$115$68:ff:7b:9c:eb:36$98:22:ef:d5:cc:2f$192.168.0.1$192.168.0.104$17$101$$$$Standard query response 0x7159 A marketplace.visualstudio.com A 13.107.42.18 OPT
263$Feb 13, 2020 22:09:16.907167735 IST$74$98:22:ef:d5:cc:2f$68:ff:7b:9c:eb:36$192.168.0.104$13.107.42.18$6$60$0$42532$443$42532 → 443 [SYN] Seq=0 Win=64240 Len=0 MSS=1460 SACK_PERM=1 TSval=1703223030 TSecr=0 WS=128
264$Feb 13, 2020 22:09:16.924088607 IST$66$68:ff:7b:9c:eb:36$98:22:ef:d5:cc:2f$13.107.42.18$192.168.0.104$6$52$0$443$42532$443 → 42532 [SYN, ACK] Seq=0 Ack=1 Win=65535 Len=0 MSS=1440 WS=256 SACK_PERM=1
265$Feb 13, 2020 22:09:16.924210093 IST$54$98:22:ef:d5:cc:2f$68:ff:7b:9c:eb:36$192.168.0.104$13.107.42.18$6$40$0$42532$443$42532 → 443 [ACK] Seq=1 Ack=1 Win=64256 Len=0
266$Feb 13, 2020 22:09:16.925085376 IST$571$98:22:ef:d5:cc:2f$68:ff:7b:9c:eb:36$192.168.0.104$13.107.42.18$6$557$517$42532$443$Client Hello
267$Feb 13, 2020 22:09:16.938908996 IST$54$68:ff:7b:9c:eb:36$98:22:ef:d5:cc:2f$13.107.42.18$192.168.0.104$6$40$0$443$42532$443 → 42532 [ACK] Seq=1 Ack=518 Win=262144 Len=0
268$Feb 13, 2020 22:09:16.942588672 IST$8137$68:ff:7b:9c:eb:36$98:22:ef:d5:cc:2f$13.107.42.18$192.168.0.104$6$8123$8083$443$42532$Server Hello, Certificate, Certificate Status, Server Key Exchange, Server Hello Done
269$Feb 13, 2020 22:09:16.942634033 IST$54$98:22:ef:d5:cc:2f$68:ff:7b:9c:eb:36$192.168.0.104$13.107.42.18$6$40$0$42532$443$42532 → 443 [ACK] Seq=518 Ack=8084 Win=58368 Len=0
270$Feb 13, 2020 22:09:17.017369485 IST$99$98:22:ef:d5:cc:2f$68:ff:7b:9c:eb:36$192.168.0.104$192.168.0.1$17$85$$$$Standard query 0x3d34 A update.code.visualstudio.com OPT
271$Feb 13, 2020 22:09:17.028383517 IST$313$68:ff:7b:9c:eb:36$98:22:ef:d5:cc:2f$192.168.0.1$192.168.0.104$17$299$$$$Standard query response 0x3d34 A update.code.visualstudio.com CNAME vscode-update.trafficmanager.net CNAME vscode-update-westeurope.azurewebsites.net CNAME waws-prod-am2-193.sip.azurewebsites.windows.net CNAME waws-prod-am2-193.cloudapp.net A 51.144.164.215 OPT
272$Feb 13, 2020 22:09:17.029959475 IST$74$98:22:ef:d5:cc:2f$68:ff:7b:9c:eb:36$192.168.0.104$51.144.164.215$6$60$0$44448$443$44448 → 443 [SYN] Seq=0 Win=64240 Len=0 MSS=1460 SACK_PERM=1 TSval=3089980875 TSecr=0 WS=128
273$Feb 13, 2020 22:09:17.073056927 IST$93$98:22:ef:d5:cc:2f$68:ff:7b:9c:eb:36$192.168.0.104$192.168.0.1$17$79$$$$Standard query 0xf4e1 A az764295.vo.msecnd.net OPT
274$Feb 13, 2020 22:09:17.084238803 IST$138$68:ff:7b:9c:eb:36$98:22:ef:d5:cc:2f$192.168.0.1$192.168.0.104$17$124$$$$Standard query response 0xf4e1 A az764295.vo.msecnd.net CNAME cs22.wpc.v0cdn.net A 117.18.232.200 OPT
275$Feb 13, 2020 22:09:17.085077826 IST$74$98:22:ef:d5:cc:2f$68:ff:7b:9c:eb:36$192.168.0.104$117.18.232.200$6$60$0$39652$443$39652 → 443 [SYN] Seq=0 Win=64240 Len=0 MSS=1460 SACK_PERM=1 TSval=2800920898 TSecr=0 WS=128
276$Feb 13, 2020 22:09:17.101033578 IST$212$98:22:ef:d5:cc:2f$68:ff:7b:9c:eb:36$192.168.0.104$13.107.42.18$6$198$158$42532$443$Client Key Exchange, Change Cipher Spec, Encrypted Handshake Message
277$Feb 13, 2020 22:09:17.102709525 IST$1010$98:22:ef:d5:cc:2f$68:ff:7b:9c:eb:36$192.168.0.104$13.107.42.18$6$996$956$42532$443$Application Data, Application Data, Application Data
278$Feb 13, 2020 22:09:17.116248402 IST$54$68:ff:7b:9c:eb:36$98:22:ef:d5:cc:2f$13.107.42.18$192.168.0.104$6$40$0$443$42532$443 → 42532 [ACK] Seq=8084 Ack=676 Win=261888 Len=0
279$Feb 13, 2020 22:09:17.116292941 IST$105$68:ff:7b:9c:eb:36$98:22:ef:d5:cc:2f$13.107.42.18$192.168.0.104$6$91$51$443$42532$Change Cipher Spec, Encrypted Handshake Message
280$Feb 13, 2020 22:09:17.116315514 IST$54$98:22:ef:d5:cc:2f$68:ff:7b:9c:eb:36$192.168.0.104$13.107.42.18$6$40$0$42532$443$42532 → 443 [ACK] Seq=1632 Ack=8135 Win=64128 Len=0
281$Feb 13, 2020 22:09:17.116343297 IST$123$68:ff:7b:9c:eb:36$98:22:ef:d5:cc:2f$13.107.42.18$192.168.0.104$6$109$69$443$42532$Application Data
282$Feb 13, 2020 22:09:17.116356574 IST$54$98:22:ef:d5:cc:2f$68:ff:7b:9c:eb:36$192.168.0.104$13.107.42.18$6$40$0$42532$443$42532 → 443 [ACK] Seq=1632 Ack=8204 Win=64128 Len=0
283$Feb 13, 2020 22:09:17.116676840 IST$92$98:22:ef:d5:cc:2f$68:ff:7b:9c:eb:36$192.168.0.104$13.107.42.18$6$78$38$42532$443$Application Data
284$Feb 13, 2020 22:09:17.120825047 IST$54$68:ff:7b:9c:eb:36$98:22:ef:d5:cc:2f$13.107.42.18$192.168.0.104$6$40$0$443$42532$443 → 42532 [ACK] Seq=8204 Ack=1632 Win=262656 Len=0
285$Feb 13, 2020 22:09:17.124015640 IST$66$68:ff:7b:9c:eb:36$98:22:ef:d5:cc:2f$117.18.232.200$192.168.0.104$6$52$0$443$39652$443 → 39652 [SYN, ACK] Seq=0 Ack=1 Win=65535 Len=0 MSS=1460 SACK_PERM=1 WS=512
286$Feb 13, 2020 22:09:17.124081123 IST$54$98:22:ef:d5:cc:2f$68:ff:7b:9c:eb:36$192.168.0.104$117.18.232.200$6$40$0$39652$443$39652 → 443 [ACK] Seq=1 Ack=1 Win=64256 Len=0
287$Feb 13, 2020 22:09:17.124507162 IST$571$98:22:ef:d5:cc:2f$68:ff:7b:9c:eb:36$192.168.0.104$117.18.232.200$6$557$517$39652$443$Client Hello
288$Feb 13, 2020 22:09:17.137533701 IST$92$68:ff:7b:9c:eb:36$98:22:ef:d5:cc:2f$13.107.42.18$192.168.0.104$6$78$38$443$42532$Application Data
289$Feb 13, 2020 22:09:17.160865208 IST$74$68:ff:7b:9c:eb:36$98:22:ef:d5:cc:2f$51.144.164.215$192.168.0.104$6$60$0$443$44448$443 → 44448 [SYN, ACK] Seq=0 Ack=1 Win=8192 Len=0 MSS=1440 WS=256 SACK_PERM=1 TSval=1508004311 TSecr=3089980875
290$Feb 13, 2020 22:09:17.160917781 IST$66$98:22:ef:d5:cc:2f$68:ff:7b:9c:eb:36$192.168.0.104$51.144.164.215$6$52$0$44448$443$44448 → 443 [ACK] Seq=1 Ack=1 Win=64256 Len=0 TSval=3089981006 TSecr=1508004311
291$Feb 13, 2020 22:09:17.161259561 IST$583$98:22:ef:d5:cc:2f$68:ff:7b:9c:eb:36$192.168.0.104$51.144.164.215$6$569$517$44448$443$Client Hello
292$Feb 13, 2020 22:09:17.172310401 IST$54$68:ff:7b:9c:eb:36$98:22:ef:d5:cc:2f$117.18.232.200$192.168.0.104$6$40$0$443$39652$443 → 39652 [ACK] Seq=1 Ack=518 Win=67072 Len=0
293$Feb 13, 2020 22:09:17.172337679 IST$54$68:ff:7b:9c:eb:36$98:22:ef:d5:cc:2f$117.18.232.200$192.168.0.104$6$40$0$443$39652$[TCP Dup ACK 292#1] 443 → 39652 [ACK] Seq=1 Ack=518 Win=67072 Len=0
294$Feb 13, 2020 22:09:17.172345412 IST$153$68:ff:7b:9c:eb:36$98:22:ef:d5:cc:2f$117.18.232.200$192.168.0.104$6$139$99$443$39652$Hello Retry Request, Change Cipher Spec
295$Feb 13, 2020 22:09:17.172361695 IST$54$98:22:ef:d5:cc:2f$68:ff:7b:9c:eb:36$192.168.0.104$117.18.232.200$6$40$0$39652$443$39652 → 443 [ACK] Seq=518 Ack=100 Win=64256 Len=0
296$Feb 13, 2020 22:09:17.172776882 IST$577$98:22:ef:d5:cc:2f$68:ff:7b:9c:eb:36$192.168.0.104$117.18.232.200$6$563$523$39652$443$Change Cipher Spec, Client Hello
297$Feb 13, 2020 22:09:17.179448336 IST$54$98:22:ef:d5:cc:2f$68:ff:7b:9c:eb:36$192.168.0.104$13.107.42.18$6$40$0$42532$443$42532 → 443 [ACK] Seq=1670 Ack=8242 Win=64128 Len=0
298$Feb 13, 2020 22:09:17.212960343 IST$1514$68:ff:7b:9c:eb:36$98:22:ef:d5:cc:2f$117.18.232.200$192.168.0.104$6$1500$1460$443$39652$Server Hello, Application Data
299$Feb 13, 2020 22:09:17.218232085 IST$7269$68:ff:7b:9c:eb:36$98:22:ef:d5:cc:2f$117.18.232.200$192.168.0.104$6$7255$7215$443$39652$Application Data
300$Feb 13, 2020 22:09:17.218271785 IST$414$68:ff:7b:9c:eb:36$98:22:ef:d5:cc:2f$117.18.232.200$192.168.0.104$6$400$360$443$39652$Application Data, Application Data
301$Feb 13, 2020 22:09:17.218385434 IST$54$98:22:ef:d5:cc:2f$68:ff:7b:9c:eb:36$192.168.0.104$117.18.232.200$6$40$0$39652$443$39652 → 443 [ACK] Seq=1041 Ack=9135 Win=64128 Len=0
302$Feb 13, 2020 22:09:17.234610036 IST$128$98:22:ef:d5:cc:2f$68:ff:7b:9c:eb:36$192.168.0.104$117.18.232.200$6$114$74$39652$443$Application Data
303$Feb 13, 2020 22:09:17.238904160 IST$433$98:22:ef:d5:cc:2f$68:ff:7b:9c:eb:36$192.168.0.104$117.18.232.200$6$419$379$39652$443$Application Data, Application Data
304$Feb 13, 2020 22:09:17.277256889 IST$325$68:ff:7b:9c:eb:36$98:22:ef:d5:cc:2f$117.18.232.200$192.168.0.104$6$311$271$443$39652$Application Data
305$Feb 13, 2020 22:09:17.277326976 IST$325$68:ff:7b:9c:eb:36$98:22:ef:d5:cc:2f$117.18.232.200$192.168.0.104$6$311$271$443$39652$Application Data
306$Feb 13, 2020 22:09:17.277403478 IST$150$68:ff:7b:9c:eb:36$98:22:ef:d5:cc:2f$117.18.232.200$192.168.0.104$6$136$96$443$39652$Application Data, Application Data
307$Feb 13, 2020 22:09:17.277562187 IST$54$98:22:ef:d5:cc:2f$68:ff:7b:9c:eb:36$192.168.0.104$117.18.232.200$6$40$0$39652$443$39652 → 443 [ACK] Seq=1494 Ack=9773 Win=64128 Len=0
308$Feb 13, 2020 22:09:17.277855412 IST$85$98:22:ef:d5:cc:2f$68:ff:7b:9c:eb:36$192.168.0.104$117.18.232.200$6$71$31$39652$443$Application Data
309$Feb 13, 2020 22:09:17.283942705 IST$85$68:ff:7b:9c:eb:36$98:22:ef:d5:cc:2f$117.18.232.200$192.168.0.104$6$71$31$443$39652$Application Data
310$Feb 13, 2020 22:09:17.284188250 IST$341$68:ff:7b:9c:eb:36$98:22:ef:d5:cc:2f$117.18.232.200$192.168.0.104$6$327$287$443$39652$Application Data
311$Feb 13, 2020 22:09:17.284282894 IST$54$98:22:ef:d5:cc:2f$68:ff:7b:9c:eb:36$192.168.0.104$117.18.232.200$6$40$0$39652$443$39652 → 443 [ACK] Seq=1525 Ack=10091 Win=64128 Len=0
312$Feb 13, 2020 22:09:17.284999139 IST$89$98:22:ef:d5:cc:2f$68:ff:7b:9c:eb:36$192.168.0.104$117.18.232.200$6$75$35$39652$443$Application Data
313$Feb 13, 2020 22:09:17.294149880 IST$2962$68:ff:7b:9c:eb:36$98:22:ef:d5:cc:2f$51.144.164.215$192.168.0.104$6$2948$2896$443$44448$[TCP segment of a reassembled PDU]
314$Feb 13, 2020 22:09:17.294229881 IST$66$98:22:ef:d5:cc:2f$68:ff:7b:9c:eb:36$192.168.0.104$51.144.164.215$6$52$0$44448$443$44448 → 443 [ACK] Seq=518 Ack=2897 Win=63104 Len=0 TSval=3089981139 TSecr=1508004443
315$Feb 13, 2020 22:09:17.295227904 IST$1327$68:ff:7b:9c:eb:36$98:22:ef:d5:cc:2f$51.144.164.215$192.168.0.104$6$1313$1261$443$44448$Server Hello, Certificate, Server Key Exchange, Server Hello Done
316$Feb 13, 2020 22:09:17.295264436 IST$66$98:22:ef:d5:cc:2f$68:ff:7b:9c:eb:36$192.168.0.104$51.144.164.215$6$52$0$44448$443$44448 → 443 [ACK] Seq=518 Ack=4158 Win=64128 Len=0 TSval=3089981140 TSecr=1508004443
317$Feb 13, 2020 22:09:17.301073795 IST$192$98:22:ef:d5:cc:2f$68:ff:7b:9c:eb:36$192.168.0.104$51.144.164.215$6$178$126$44448$443$Client Key Exchange, Change Cipher Spec, Encrypted Handshake Message
318$Feb 13, 2020 22:09:17.323017291 IST$54$68:ff:7b:9c:eb:36$98:22:ef:d5:cc:2f$117.18.232.200$192.168.0.104$6$40$0$443$39652$443 → 39652 [ACK] Seq=10091 Ack=1560 Win=69120 Len=0
319$Feb 13, 2020 22:09:17.342193239 IST$1514$68:ff:7b:9c:eb:36$98:22:ef:d5:cc:2f$13.107.42.18$192.168.0.104$6$1500$1460$443$42532$[TCP segment of a reassembled PDU]
320$Feb 13, 2020 22:09:17.342280357 IST$54$98:22:ef:d5:cc:2f$68:ff:7b:9c:eb:36$192.168.0.104$13.107.42.18$6$40$0$42532$443$42532 → 443 [ACK] Seq=1670 Ack=9702 Win=64128 Len=0
321$Feb 13, 2020 22:09:17.343434362 IST$1493$68:ff:7b:9c:eb:36$98:22:ef:d5:cc:2f$13.107.42.18$192.168.0.104$6$1479$1439$443$42532$Application Data
322$Feb 13, 2020 22:09:17.343498999 IST$54$98:22:ef:d5:cc:2f$68:ff:7b:9c:eb:36$192.168.0.104$13.107.42.18$6$40$0$42532$443$42532 → 443 [ACK] Seq=1670 Ack=11141 Win=64128 Len=0
323$Feb 13, 2020 22:09:17.343528197 IST$92$68:ff:7b:9c:eb:36$98:22:ef:d5:cc:2f$13.107.42.18$192.168.0.104$6$78$38$443$42532$Application Data
324$Feb 13, 2020 22:09:17.343552295 IST$54$98:22:ef:d5:cc:2f$68:ff:7b:9c:eb:36$192.168.0.104$13.107.42.18$6$40$0$42532$443$42532 → 443 [ACK] Seq=1670 Ack=11179 Win=64128 Len=0
325$Feb 13, 2020 22:09:17.435005437 IST$117$68:ff:7b:9c:eb:36$98:22:ef:d5:cc:2f$51.144.164.215$192.168.0.104$6$103$51$443$44448$Change Cipher Spec, Encrypted Handshake Message
326$Feb 13, 2020 22:09:17.435206995 IST$466$98:22:ef:d5:cc:2f$68:ff:7b:9c:eb:36$192.168.0.104$51.144.164.215$6$452$400$44448$443$Application Data
327$Feb 13, 2020 22:09:17.615070492 IST$529$68:ff:7b:9c:eb:36$98:22:ef:d5:cc:2f$51.144.164.215$192.168.0.104$6$515$463$443$44448$Application Data
328$Feb 13, 2020 22:09:17.655427951 IST$66$98:22:ef:d5:cc:2f$68:ff:7b:9c:eb:36$192.168.0.104$51.144.164.215$6$52$0$44448$443$44448 → 443 [ACK] Seq=1044 Ack=4672 Win=64128 Len=0 TSval=3089981500 TSecr=1508004717
329$Feb 13, 2020 22:09:30.982693287 IST$111$98:22:ef:d5:cc:2f$68:ff:7b:9c:eb:36$192.168.0.104$192.168.0.1$17$97$$$$Standard query 0x4a05 AAAA hk2.vortex.data.microsoft.com.akadns.net OPT
330$Feb 13, 2020 22:09:31.022606307 IST$177$68:ff:7b:9c:eb:36$98:22:ef:d5:cc:2f$192.168.0.1$192.168.0.104$17$163$$$$Standard query response 0x4a05 AAAA hk2.vortex.data.microsoft.com.akadns.net SOA internal.akadns.net OPT
331$Feb 13, 2020 22:09:31.023049057 IST$74$98:22:ef:d5:cc:2f$68:ff:7b:9c:eb:36$192.168.0.104$111.221.29.254$6$60$0$34412$443$34412 → 443 [SYN] Seq=0 Win=64240 Len=0 MSS=1460 SACK_PERM=1 TSval=654821043 TSecr=0 WS=128
332$Feb 13, 2020 22:09:31.125136996 IST$74$68:ff:7b:9c:eb:36$98:22:ef:d5:cc:2f$111.221.29.254$192.168.0.104$6$60$0$443$34412$443 → 34412 [SYN, ACK] Seq=0 Ack=1 Win=8192 Len=0 MSS=1440 WS=256 SACK_PERM=1 TSval=2255960034 TSecr=654821043
333$Feb 13, 2020 22:09:31.125180086 IST$66$98:22:ef:d5:cc:2f$68:ff:7b:9c:eb:36$192.168.0.104$111.221.29.254$6$52$0$34412$443$34412 → 443 [ACK] Seq=1 Ack=1 Win=64256 Len=0 TSval=654821145 TSecr=2255960034
334$Feb 13, 2020 22:09:31.125421677 IST$583$98:22:ef:d5:cc:2f$68:ff:7b:9c:eb:36$192.168.0.104$111.221.29.254$6$569$517$34412$443$Client Hello
335$Feb 13, 2020 22:09:31.340974276 IST$4091$68:ff:7b:9c:eb:36$98:22:ef:d5:cc:2f$111.221.29.254$192.168.0.104$6$4077$4025$443$34412$Server Hello, Certificate, Server Key Exchange, Server Hello Done
336$Feb 13, 2020 22:09:31.341009778 IST$66$98:22:ef:d5:cc:2f$68:ff:7b:9c:eb:36$192.168.0.104$111.221.29.254$6$52$0$34412$443$34412 → 443 [ACK] Seq=518 Ack=4026 Win=61952 Len=0 TSval=654821361 TSecr=2255960158
337$Feb 13, 2020 22:09:31.341630210 IST$159$98:22:ef:d5:cc:2f$68:ff:7b:9c:eb:36$192.168.0.104$111.221.29.254$6$145$93$34412$443$Client Key Exchange, Change Cipher Spec, Encrypted Handshake Message
338$Feb 13, 2020 22:09:31.442757272 IST$117$68:ff:7b:9c:eb:36$98:22:ef:d5:cc:2f$111.221.29.254$192.168.0.104$6$103$51$443$34412$Change Cipher Spec, Encrypted Handshake Message
339$Feb 13, 2020 22:09:31.444064703 IST$1494$98:22:ef:d5:cc:2f$68:ff:7b:9c:eb:36$192.168.0.104$111.221.29.254$6$1480$1428$34412$443$[TCP segment of a reassembled PDU]
340$Feb 13, 2020 22:09:31.444084454 IST$1494$98:22:ef:d5:cc:2f$68:ff:7b:9c:eb:36$192.168.0.104$111.221.29.254$6$1480$1428$34412$443$34412 → 443 [ACK] Seq=2039 Ack=4077 Win=64128 Len=1428 TSval=654821464 TSecr=2255960345 [TCP segment of a reassembled PDU]
341$Feb 13, 2020 22:09:31.450936501 IST$1494$98:22:ef:d5:cc:2f$68:ff:7b:9c:eb:36$192.168.0.104$111.221.29.254$6$1480$1428$34412$443$34412 → 443 [ACK] Seq=3467 Ack=4077 Win=64128 Len=1428 TSval=654821471 TSecr=2255960345 [TCP segment of a reassembled PDU]
342$Feb 13, 2020 22:09:31.450952093 IST$95$98:22:ef:d5:cc:2f$68:ff:7b:9c:eb:36$192.168.0.104$111.221.29.254$6$81$29$34412$443$Application Data
343$Feb 13, 2020 22:09:31.555844059 IST$66$68:ff:7b:9c:eb:36$98:22:ef:d5:cc:2f$111.221.29.254$192.168.0.104$6$52$0$443$34412$443 → 34412 [ACK] Seq=4077 Ack=3467 Win=263424 Len=0 TSval=2255960466 TSecr=654821464
344$Feb 13, 2020 22:09:31.555866575 IST$66$68:ff:7b:9c:eb:36$98:22:ef:d5:cc:2f$111.221.29.254$192.168.0.104$6$52$0$443$34412$443 → 34412 [ACK] Seq=4077 Ack=4924 Win=263424 Len=0 TSval=2255960467 TSecr=654821471
345$Feb 13, 2020 22:09:31.749381777 IST$381$68:ff:7b:9c:eb:36$98:22:ef:d5:cc:2f$111.221.29.254$192.168.0.104$6$367$315$443$34412$Application Data
346$Feb 13, 2020 22:09:31.751630241 IST$97$98:22:ef:d5:cc:2f$68:ff:7b:9c:eb:36$192.168.0.104$111.221.29.254$6$83$31$34412$443$Encrypted Alert
347$Feb 13, 2020 22:09:31.756188202 IST$66$98:22:ef:d5:cc:2f$68:ff:7b:9c:eb:36$192.168.0.104$111.221.29.254$6$52$0$34412$443$34412 → 443 [FIN, ACK] Seq=4955 Ack=4393 Win=64128 Len=0 TSval=654821776 TSecr=2255960599
348$Feb 13, 2020 22:09:31.855143794 IST$66$68:ff:7b:9c:eb:36$98:22:ef:d5:cc:2f$111.221.29.254$192.168.0.104$6$52$0$443$34412$443 → 34412 [ACK] Seq=4393 Ack=4956 Win=263424 Len=0 TSval=2255960770 TSecr=654821772
349$Feb 13, 2020 22:09:32.568118932 IST$307$68:ff:7b:9c:eb:36$98:22:ef:d5:cc:2f$91.189.92.41$192.168.0.104$6$293$241$443$45012$[TCP ACKed unseen segment] , Application Data
350$Feb 13, 2020 22:09:32.568149370 IST$66$98:22:ef:d5:cc:2f$68:ff:7b:9c:eb:36$192.168.0.104$91.189.92.41$6$52$0$45012$443$[TCP Previous segment not captured] 45012 → 443 [ACK] Seq=2 Ack=242 Win=501 Len=0 TSval=587243 TSecr=903449960
351$Feb 13, 2020 22:09:32.568158237 IST$97$68:ff:7b:9c:eb:36$98:22:ef:d5:cc:2f$91.189.92.41$192.168.0.104$6$83$31$443$45012$[TCP ACKed unseen segment] , Encrypted Alert
352$Feb 13, 2020 22:09:32.568164447 IST$66$98:22:ef:d5:cc:2f$68:ff:7b:9c:eb:36$192.168.0.104$91.189.92.41$6$52$0$45012$443$45012 → 443 [ACK] Seq=2 Ack=273 Win=501 Len=0 TSval=587243 TSecr=903449960
353$Feb 13, 2020 22:09:32.568167842 IST$66$68:ff:7b:9c:eb:36$98:22:ef:d5:cc:2f$91.189.92.41$192.168.0.104$6$52$0$443$45012$443 → 45012 [FIN, ACK] Seq=273 Ack=2 Win=235 Len=0 TSval=903449960 TSecr=537204
354$Feb 13, 2020 22:09:32.568261768 IST$97$98:22:ef:d5:cc:2f$68:ff:7b:9c:eb:36$192.168.0.104$91.189.92.41$6$83$31$45012$443$Encrypted Alert
355$Feb 13, 2020 22:09:32.569749591 IST$66$98:22:ef:d5:cc:2f$68:ff:7b:9c:eb:36$192.168.0.104$91.189.92.41$6$52$0$45012$443$45012 → 443 [FIN, ACK] Seq=33 Ack=274 Win=501 Len=0 TSval=587245 TSecr=903449960
356$Feb 13, 2020 22:09:32.773006139 IST$54$68:ff:7b:9c:eb:36$98:22:ef:d5:cc:2f$91.189.92.41$192.168.0.104$6$40$0$443$45012$443 → 45012 [RST] Seq=274 Win=0 Len=0
357$Feb 13, 2020 22:09:32.773033175 IST$54$68:ff:7b:9c:eb:36$98:22:ef:d5:cc:2f$91.189.92.41$192.168.0.104$6$40$0$443$45012$443 → 45012 [RST] Seq=274 Win=0 Len=0
358$Feb 13, 2020 22:09:33.489354431 IST$97$68:ff:7b:9c:eb:36$98:22:ef:d5:cc:2f$91.189.92.41$192.168.0.104$6$83$31$443$45010$[TCP ACKed unseen segment] , Encrypted Alert
359$Feb 13, 2020 22:09:33.489385423 IST$66$98:22:ef:d5:cc:2f$68:ff:7b:9c:eb:36$192.168.0.104$91.189.92.41$6$52$0$45010$443$[TCP Previous segment not captured] 45010 → 443 [ACK] Seq=2 Ack=32 Win=2424 Len=0 TSval=588164 TSecr=903450190
360$Feb 13, 2020 22:09:33.489392930 IST$66$68:ff:7b:9c:eb:36$98:22:ef:d5:cc:2f$91.189.92.41$192.168.0.104$6$52$0$443$45010$[TCP ACKed unseen segment] 443 → 45010 [FIN, ACK] Seq=32 Ack=2 Win=299 Len=0 TSval=903450190 TSecr=538209
361$Feb 13, 2020 22:09:33.489471059 IST$97$98:22:ef:d5:cc:2f$68:ff:7b:9c:eb:36$192.168.0.104$91.189.92.41$6$83$31$45010$443$Encrypted Alert
362$Feb 13, 2020 22:09:33.490877262 IST$66$98:22:ef:d5:cc:2f$68:ff:7b:9c:eb:36$192.168.0.104$91.189.92.41$6$52$0$45010$443$45010 → 443 [FIN, ACK] Seq=33 Ack=33 Win=2424 Len=0 TSval=588166 TSecr=903450190
363$Feb 13, 2020 22:09:33.694309045 IST$54$68:ff:7b:9c:eb:36$98:22:ef:d5:cc:2f$91.189.92.41$192.168.0.104$6$40$0$443$45010$443 → 45010 [RST] Seq=33 Win=0 Len=0
364$Feb 13, 2020 22:09:33.694331730 IST$54$68:ff:7b:9c:eb:36$98:22:ef:d5:cc:2f$91.189.92.41$192.168.0.104$6$40$0$443$45010$443 → 45010 [RST] Seq=33 Win=0 Len=0
365$Feb 13, 2020 22:09:36.049485486 IST$42$68:ff:7b:9c:eb:36$98:22:ef:d5:cc:2f$$$$$$$$Who has 192.168.0.104? Tell 192.168.0.1
366$Feb 13, 2020 22:09:36.049495598 IST$42$98:22:ef:d5:cc:2f$68:ff:7b:9c:eb:36$$$$$$$$192.168.0.104 is at 98:22:ef:d5:cc:2f
367$Feb 13, 2020 22:09:38.207524349 IST$74$98:22:ef:d5:cc:2f$68:ff:7b:9c:eb:36$192.168.0.104$111.221.29.254$6$60$0$34414$443$34414 → 443 [SYN] Seq=0 Win=64240 Len=0 MSS=1460 SACK_PERM=1 TSval=654828227 TSecr=0 WS=128
368$Feb 13, 2020 22:09:38.305895901 IST$74$68:ff:7b:9c:eb:36$98:22:ef:d5:cc:2f$111.221.29.254$192.168.0.104$6$60$0$443$34414$443 → 34414 [SYN, ACK] Seq=0 Ack=1 Win=8192 Len=0 MSS=1440 WS=256 SACK_PERM=1 TSval=369893135 TSecr=654828227
369$Feb 13, 2020 22:09:38.305935011 IST$66$98:22:ef:d5:cc:2f$68:ff:7b:9c:eb:36$192.168.0.104$111.221.29.254$6$52$0$34414$443$34414 → 443 [ACK] Seq=1 Ack=1 Win=64256 Len=0 TSval=654828325 TSecr=369893135
370$Feb 13, 2020 22:09:38.306277768 IST$583$98:22:ef:d5:cc:2f$68:ff:7b:9c:eb:36$192.168.0.104$111.221.29.254$6$569$517$34414$443$Client Hello
371$Feb 13, 2020 22:09:38.408199968 IST$1514$68:ff:7b:9c:eb:36$98:22:ef:d5:cc:2f$111.221.29.254$192.168.0.104$6$1500$1448$443$34414$[TCP segment of a reassembled PDU]
372$Feb 13, 2020 22:09:38.408231964 IST$66$98:22:ef:d5:cc:2f$68:ff:7b:9c:eb:36$192.168.0.104$111.221.29.254$6$52$0$34414$443$34414 → 443 [ACK] Seq=518 Ack=1449 Win=64128 Len=0 TSval=654828428 TSecr=369893238
373$Feb 13, 2020 22:09:38.408597295 IST$2643$68:ff:7b:9c:eb:36$98:22:ef:d5:cc:2f$111.221.29.254$192.168.0.104$6$2629$2577$443$34414$Server Hello, Certificate, Server Key Exchange, Server Hello Done
374$Feb 13, 2020 22:09:38.408619738 IST$66$98:22:ef:d5:cc:2f$68:ff:7b:9c:eb:36$192.168.0.104$111.221.29.254$6$52$0$34414$443$34414 → 443 [ACK] Seq=518 Ack=4026 Win=63104 Len=0 TSval=654828428 TSecr=369893238
375$Feb 13, 2020 22:09:38.409230243 IST$159$98:22:ef:d5:cc:2f$68:ff:7b:9c:eb:36$192.168.0.104$111.221.29.254$6$145$93$34414$443$Client Key Exchange, Change Cipher Spec, Encrypted Handshake Message
376$Feb 13, 2020 22:09:38.505010840 IST$66$68:ff:7b:9c:eb:36$98:22:ef:d5:cc:2f$111.221.29.254$192.168.0.104$6$52$0$443$34414$443 → 34414 [ACK] Seq=4026 Ack=611 Win=263424 Len=0 TSval=369893335 TSecr=654828429
377$Feb 13, 2020 22:09:38.505029340 IST$66$68:ff:7b:9c:eb:36$98:22:ef:d5:cc:2f$111.221.29.254$192.168.0.104$6$52$0$443$34414$[TCP Dup ACK 376#1] 443 → 34414 [ACK] Seq=4026 Ack=611 Win=263424 Len=0 TSval=369893335 TSecr=654828429
378$Feb 13, 2020 22:09:38.505961479 IST$117$68:ff:7b:9c:eb:36$98:22:ef:d5:cc:2f$111.221.29.254$192.168.0.104$6$103$51$443$34414$Change Cipher Spec, Encrypted Handshake Message
379$Feb 13, 2020 22:09:38.506608307 IST$1035$98:22:ef:d5:cc:2f$68:ff:7b:9c:eb:36$192.168.0.104$111.221.29.254$6$1021$969$34414$443$Application Data
380$Feb 13, 2020 22:09:38.685212623 IST$66$98:22:ef:d5:cc:2f$68:ff:7b:9c:eb:36$192.168.0.104$111.221.29.254$6$52$0$34414$443$34414 → 443 [FIN, ACK] Seq=1580 Ack=4077 Win=64128 Len=0 TSval=654828705 TSecr=369893336
381$Feb 13, 2020 22:09:38.707397746 IST$54$98:22:ef:d5:cc:2f$68:ff:7b:9c:eb:36$192.168.0.104$13.107.42.18$6$40$0$42532$443$42532 → 443 [FIN, ACK] Seq=1670 Ack=11179 Win=64128 Len=0
382$Feb 13, 2020 22:09:38.707474014 IST$54$98:22:ef:d5:cc:2f$68:ff:7b:9c:eb:36$192.168.0.104$117.18.232.200$6$40$0$39652$443$39652 → 443 [FIN, ACK] Seq=1560 Ack=10091 Win=64128 Len=0
383$Feb 13, 2020 22:09:38.707520304 IST$66$98:22:ef:d5:cc:2f$68:ff:7b:9c:eb:36$192.168.0.104$51.144.164.215$6$52$0$44448$443$44448 → 443 [FIN, ACK] Seq=1044 Ack=4672 Win=64128 Len=0 TSval=3090002550 TSecr=1508004717
384$Feb 13, 2020 22:09:38.727330395 IST$54$68:ff:7b:9c:eb:36$98:22:ef:d5:cc:2f$13.107.42.18$192.168.0.104$6$40$0$443$42532$443 → 42532 [ACK] Seq=11179 Ack=1671 Win=262656 Len=0
385$Feb 13, 2020 22:09:38.727358206 IST$54$68:ff:7b:9c:eb:36$98:22:ef:d5:cc:2f$13.107.42.18$192.168.0.104$6$40$0$443$42532$443 → 42532 [FIN, ACK] Seq=11179 Ack=1671 Win=262656 Len=0
386$Feb 13, 2020 22:09:38.727370805 IST$54$98:22:ef:d5:cc:2f$68:ff:7b:9c:eb:36$192.168.0.104$13.107.42.18$6$40$0$42532$443$42532 → 443 [ACK] Seq=1671 Ack=11180 Win=64128 Len=0
387$Feb 13, 2020 22:09:38.746560674 IST$78$68:ff:7b:9c:eb:36$98:22:ef:d5:cc:2f$117.18.232.200$192.168.0.104$6$64$24$443$39652$Application Data
388$Feb 13, 2020 22:09:38.746596320 IST$54$98:22:ef:d5:cc:2f$68:ff:7b:9c:eb:36$192.168.0.104$117.18.232.200$6$40$0$39652$443$39652 → 443 [RST] Seq=1561 Win=0 Len=0
389$Feb 13, 2020 22:09:38.746608273 IST$54$68:ff:7b:9c:eb:36$98:22:ef:d5:cc:2f$117.18.232.200$192.168.0.104$6$40$0$443$39652$443 → 39652 [FIN, ACK] Seq=10115 Ack=1561 Win=69120 Len=0
390$Feb 13, 2020 22:09:38.746616058 IST$54$98:22:ef:d5:cc:2f$68:ff:7b:9c:eb:36$192.168.0.104$117.18.232.200$6$40$0$39652$443$39652 → 443 [RST] Seq=1561 Win=0 Len=0
391$Feb 13, 2020 22:09:38.754038015 IST$66$68:ff:7b:9c:eb:36$98:22:ef:d5:cc:2f$111.221.29.254$192.168.0.104$6$52$0$443$34414$443 → 34414 [ACK] Seq=4077 Ack=1580 Win=262400 Len=0 TSval=369893584 TSecr=654828526
392$Feb 13, 2020 22:09:38.819522528 IST$380$68:ff:7b:9c:eb:36$98:22:ef:d5:cc:2f$111.221.29.254$192.168.0.104$6$366$314$443$34414$Application Data
393$Feb 13, 2020 22:09:38.819551887 IST$54$98:22:ef:d5:cc:2f$68:ff:7b:9c:eb:36$192.168.0.104$111.221.29.254$6$40$0$34414$443$34414 → 443 [RST] Seq=1581 Win=0 Len=0
394$Feb 13, 2020 22:09:38.841491948 IST$66$68:ff:7b:9c:eb:36$98:22:ef:d5:cc:2f$51.144.164.215$192.168.0.104$6$52$0$443$44448$443 → 44448 [FIN, ACK] Seq=4672 Ack=1045 Win=262912 Len=0 TSval=1508025988 TSecr=3090002550
395$Feb 13, 2020 22:09:38.841516017 IST$66$98:22:ef:d5:cc:2f$68:ff:7b:9c:eb:36$192.168.0.104$51.144.164.215$6$52$0$44448$443$44448 → 443 [ACK] Seq=1045 Ack=4673 Win=64128 Len=0 TSval=3090002684 TSecr=1508025988
396$Feb 13, 2020 22:09:38.850997446 IST$54$68:ff:7b:9c:eb:36$98:22:ef:d5:cc:2f$117.18.232.200$192.168.0.104$6$40$0$443$39652$[TCP Retransmission] 443 → 39652 [FIN, ACK] Seq=10115 Ack=1561 Win=69120 Len=0
397$Feb 13, 2020 22:09:38.851020118 IST$54$98:22:ef:d5:cc:2f$68:ff:7b:9c:eb:36$192.168.0.104$117.18.232.200$6$40$0$39652$443$39652 → 443 [RST] Seq=1561 Win=0 Len=0
398$Feb 13, 2020 22:09:44.542855332 IST$97$98:22:ef:d5:cc:2f$68:ff:7b:9c:eb:36$192.168.0.104$91.189.92.17$6$83$31$41290$443$Encrypted Alert
399$Feb 13, 2020 22:09:44.545538013 IST$66$98:22:ef:d5:cc:2f$68:ff:7b:9c:eb:36$192.168.0.104$91.189.92.17$6$52$0$41290$443$41290 → 443 [RST, ACK] Seq=32 Ack=1 Win=920 Len=0 TSval=3058710492 TSecr=2345082627
400$Feb 13, 2020 22:09:44.771150668 IST$93$98:22:ef:d5:cc:2f$68:ff:7b:9c:eb:36$192.168.0.104$192.168.0.1$17$79$$$$Standard query 0xa9b0 A dt.adsafeprotected.com OPT
401$Feb 13, 2020 22:09:44.771273957 IST$93$98:22:ef:d5:cc:2f$68:ff:7b:9c:eb:36$192.168.0.104$192.168.0.1$17$79$$$$Standard query 0xb172 AAAA dt.adsafeprotected.com OPT
402$Feb 13, 2020 22:09:44.785688042 IST$129$68:ff:7b:9c:eb:36$98:22:ef:d5:cc:2f$192.168.0.1$192.168.0.104$17$115$$$$Standard query response 0xa9b0 A dt.adsafeprotected.com CNAME nyidt.adsafeprotected.com A 104.244.36.20 OPT
403$Feb 13, 2020 22:09:44.785711866 IST$178$68:ff:7b:9c:eb:36$98:22:ef:d5:cc:2f$192.168.0.1$192.168.0.104$17$164$$$$Standard query response 0xb172 AAAA dt.adsafeprotected.com CNAME nyidt.adsafeprotected.com SOA dns1.p05.nsone.net OPT
404$Feb 13, 2020 22:09:44.786084826 IST$96$98:22:ef:d5:cc:2f$68:ff:7b:9c:eb:36$192.168.0.104$192.168.0.1$17$82$$$$Standard query 0x6bca AAAA nyidt.adsafeprotected.com OPT
405$Feb 13, 2020 22:09:44.796732115 IST$161$68:ff:7b:9c:eb:36$98:22:ef:d5:cc:2f$192.168.0.1$192.168.0.104$17$147$$$$Standard query response 0x6bca AAAA nyidt.adsafeprotected.com SOA dns1.p05.nsone.net OPT
406$Feb 13, 2020 22:09:44.797308856 IST$74$98:22:ef:d5:cc:2f$68:ff:7b:9c:eb:36$192.168.0.104$104.244.36.20$6$60$0$43176$443$43176 → 443 [SYN] Seq=0 Win=64240 Len=0 MSS=1460 SACK_PERM=1 TSval=209827473 TSecr=0 WS=128
407$Feb 13, 2020 22:09:44.904934550 IST$101$98:22:ef:d5:cc:2f$68:ff:7b:9c:eb:36$192.168.0.104$54.149.145.192$6$87$35$40730$443$[TCP ACKed unseen segment] [TCP Previous segment not captured] , Application Data
408$Feb 13, 2020 22:09:44.956201019 IST$100$98:22:ef:d5:cc:2f$68:ff:7b:9c:eb:36$192.168.0.104$192.168.0.1$17$86$$$$Standard query 0x5e23 A pagead2.googlesyndication.com OPT
409$Feb 13, 2020 22:09:44.956318201 IST$74$98:22:ef:d5:cc:2f$68:ff:7b:9c:eb:36$192.168.0.104$172.217.166.34$6$60$0$34604$443$34604 → 443 [SYN] Seq=0 Win=64240 Len=0 MSS=1460 SACK_PERM=1 TSval=3567298323 TSecr=0 WS=128
410$Feb 13, 2020 22:09:44.956326761 IST$100$98:22:ef:d5:cc:2f$68:ff:7b:9c:eb:36$192.168.0.104$192.168.0.1$17$86$$$$Standard query 0xc8f2 AAAA pagead2.googlesyndication.com OPT
411$Feb 13, 2020 22:09:44.956458629 IST$532$98:22:ef:d5:cc:2f$68:ff:7b:9c:eb:36$192.168.0.104$172.217.166.34$6$518$466$34578$443$Application Data
412$Feb 13, 2020 22:09:44.967962034 IST$105$98:22:ef:d5:cc:2f$68:ff:7b:9c:eb:36$192.168.0.104$172.217.160.206$6$91$39$33220$443$Application Data
413$Feb 13, 2020 22:09:44.968855195 IST$136$98:22:ef:d5:cc:2f$68:ff:7b:9c:eb:36$192.168.0.104$172.217.166.34$6$122$70$34578$443$Application Data, Application Data
414$Feb 13, 2020 22:09:44.969002901 IST$90$98:22:ef:d5:cc:2f$68:ff:7b:9c:eb:36$192.168.0.104$172.217.160.206$6$76$24$33220$443$Application Data
415$Feb 13, 2020 22:09:44.971152938 IST$74$68:ff:7b:9c:eb:36$98:22:ef:d5:cc:2f$172.217.166.34$192.168.0.104$6$60$0$443$34604$443 → 34604 [SYN, ACK] Seq=0 Ack=1 Win=60192 Len=0 MSS=1380 SACK_PERM=1 TSval=3211358318 TSecr=3567298323 WS=256
416$Feb 13, 2020 22:09:44.971188307 IST$54$98:22:ef:d5:cc:2f$68:ff:7b:9c:eb:36$192.168.0.104$172.217.166.34$6$40$0$34604$443$34604 → 443 [RST] Seq=1 Win=0 Len=0
417$Feb 13, 2020 22:09:44.974624912 IST$156$68:ff:7b:9c:eb:36$98:22:ef:d5:cc:2f$192.168.0.1$192.168.0.104$17$142$$$$Standard query response 0x5e23 A pagead2.googlesyndication.com CNAME pagead46.l.doubleclick.net A 216.58.199.162 OPT
418$Feb 13, 2020 22:09:44.974661213 IST$168$68:ff:7b:9c:eb:36$98:22:ef:d5:cc:2f$192.168.0.1$192.168.0.104$17$154$$$$Standard query response 0xc8f2 AAAA pagead2.googlesyndication.com CNAME pagead46.l.doubleclick.net AAAA 2404:6800:4009:80f::2002 OPT
419$Feb 13, 2020 22:09:44.976106953 IST$97$98:22:ef:d5:cc:2f$68:ff:7b:9c:eb:36$192.168.0.104$54.149.145.192$6$83$31$40730$443$[TCP ACKed unseen segment] , Encrypted Alert
420$Feb 13, 2020 22:09:44.997276904 IST$66$98:22:ef:d5:cc:2f$68:ff:7b:9c:eb:36$192.168.0.104$54.149.145.192$6$52$0$40730$443$[TCP ACKed unseen segment] 40730 → 443 [FIN, ACK] Seq=384 Ack=282 Win=501 Len=0 TSval=3504023066 TSecr=1732395358
421$Feb 13, 2020 22:09:44.997293399 IST$90$98:22:ef:d5:cc:2f$68:ff:7b:9c:eb:36$192.168.0.104$172.217.166.34$6$76$24$34578$443$Application Data
422$Feb 13, 2020 22:09:45.001302316 IST$74$68:ff:7b:9c:eb:36$98:22:ef:d5:cc:2f$104.244.36.20$192.168.0.104$6$60$0$443$43176$443 → 43176 [SYN, ACK] Seq=0 Ack=1 Win=28960 Len=0 MSS=1460 SACK_PERM=1 TSval=1987902754 TSecr=209827473 WS=512
423$Feb 13, 2020 22:09:45.001325170 IST$54$98:22:ef:d5:cc:2f$68:ff:7b:9c:eb:36$192.168.0.104$104.244.36.20$6$40$0$43176$443$43176 → 443 [RST] Seq=1 Win=0 Len=0
424$Feb 13, 2020 22:09:45.008253485 IST$66$68:ff:7b:9c:eb:36$98:22:ef:d5:cc:2f$172.217.166.34$192.168.0.104$6$52$0$443$34578$443 → 34578 [ACK] Seq=1 Ack=537 Win=253 Len=0 TSval=3211358355 TSecr=3567298323
425$Feb 13, 2020 22:09:45.009147204 IST$66$68:ff:7b:9c:eb:36$98:22:ef:d5:cc:2f$172.217.160.206$192.168.0.104$6$52$0$443$33220$443 → 33220 [ACK] Seq=1 Ack=65 Win=248 Len=0 TSval=299518086 TSecr=3703331723
426$Feb 13, 2020 22:09:45.009169002 IST$66$68:ff:7b:9c:eb:36$98:22:ef:d5:cc:2f$172.217.160.206$192.168.0.104$6$52$0$443$33220$443 → 33220 [FIN, ACK] Seq=1 Ack=65 Win=248 Len=0 TSval=299518086 TSecr=3703331723
427$Feb 13, 2020 22:09:45.009187056 IST$66$98:22:ef:d5:cc:2f$68:ff:7b:9c:eb:36$192.168.0.104$172.217.160.206$6$52$0$33220$443$33220 → 443 [ACK] Seq=65 Ack=2 Win=501 Len=0 TSval=3703331764 TSecr=299518086
428$Feb 13, 2020 22:09:45.013451811 IST$66$68:ff:7b:9c:eb:36$98:22:ef:d5:cc:2f$172.217.166.34$192.168.0.104$6$52$0$443$34578$443 → 34578 [FIN, ACK] Seq=1 Ack=562 Win=253 Len=0 TSval=3211358361 TSecr=3567298364
429$Feb 13, 2020 22:09:45.013485115 IST$66$98:22:ef:d5:cc:2f$68:ff:7b:9c:eb:36$192.168.0.104$172.217.166.34$6$52$0$34578$443$34578 → 443 [ACK] Seq=562 Ack=2 Win=501 Len=0 TSval=3567298380 TSecr=3211358361
430$Feb 13, 2020 22:09:45.266842381 IST$66$68:ff:7b:9c:eb:36$98:22:ef:d5:cc:2f$54.149.145.192$192.168.0.104$6$52$0$443$40730$[TCP ACKed unseen segment] [TCP Previous segment not captured] 443 → 40730 [ACK] Seq=282 Ack=353 Win=118 Len=0 TSval=1732552763 TSecr=3504022974
431$Feb 13, 2020 22:09:45.266869598 IST$97$68:ff:7b:9c:eb:36$98:22:ef:d5:cc:2f$54.149.145.192$192.168.0.104$6