frame.number$frame.time$frame.len$eth.src$eth.dst$ip.src$ip.dst$ip.proto$ip.len$tcp.len$tcp.srcport$tcp.dstport$_ws.col.Info
1$May 28, 2020 19:42:37.929313788 UTC$54$50:02:91:69:66:71$98:22:ef:d5:cc:2f$169.254.114.102$192.168.0.121$6$40$0$57712$80$57712 → 80 [RST, ACK] Seq=1 Ack=1 Win=24584 Len=0
2$May 28, 2020 19:42:37.929422710 UTC$62$50:02:91:69:66:71$98:22:ef:d5:cc:2f$169.254.114.102$192.168.0.121$6$48$0$52995$80$52995 → 80 [SYN] Seq=0 Win=2144 Len=0 MSS=536 SACK_PERM=1
3$May 28, 2020 19:42:37.929460428 UTC$62$98:22:ef:d5:cc:2f$06:8e:c3:81:b4:62$192.168.0.121$169.254.114.102$6$48$0$80$52995$80 → 52995 [SYN, ACK] Seq=0 Ack=1 Win=64240 Len=0 MSS=1460 SACK_PERM=1
4$May 28, 2020 19:42:38.950483279 UTC$62$98:22:ef:d5:cc:2f$06:8e:c3:81:b4:62$192.168.0.121$169.254.114.102$6$48$0$80$52995$[TCP Retransmission] 80 → 52995 [SYN, ACK] Seq=0 Ack=1 Win=64240 Len=0 MSS=1460 SACK_PERM=1
5$May 28, 2020 19:42:40.070498335 UTC$62$98:22:ef:d5:cc:2f$06:8e:c3:81:b4:62$192.168.0.121$169.254.114.102$6$48$0$80$57712$[TCP Port numbers reused] 80 → 57712 [SYN, ACK] Seq=581384752 Ack=1 Win=64240 Len=0 MSS=1460 SACK_PERM=1
6$May 28, 2020 19:42:40.072994096 UTC$62$98:22:ef:d5:cc:2f$06:8e:c3:81:b4:62$192.168.0.121$169.254.114.102$6$48$0$80$58595$80 → 58595 [SYN, ACK] Seq=0 Ack=1 Win=64240 Len=0 MSS=1460 SACK_PERM=1
7$May 28, 2020 19:42:40.326516610 UTC$62$98:22:ef:d5:cc:2f$06:8e:c3:81:b4:62$192.168.0.121$169.254.114.102$6$48$0$80$54839$80 → 54839 [SYN, ACK] Seq=0 Ack=1 Win=64240 Len=0 MSS=1460 SACK_PERM=1
8$May 28, 2020 19:42:40.584104531 UTC$100$98:22:ef:d5:cc:2f$01:00:5e:00:00:fb$192.168.0.121$224.0.0.251$17$86$$$$Standard query response 0x0000 A, cache flush 192.168.0.121
9$May 28, 2020 19:42:40.584223342 UTC$100$98:22:ef:d5:cc:2f$01:00:5e:00:00:fb$192.168.0.121$224.0.0.251$17$86$$$$Standard query response 0x0000 A, cache flush 192.168.0.121
10$May 28, 2020 19:42:40.966493756 UTC$62$98:22:ef:d5:cc:2f$06:8e:c3:81:b4:62$192.168.0.121$169.254.114.102$6$48$0$80$52995$[TCP Retransmission] 80 → 52995 [SYN, ACK] Seq=0 Ack=1 Win=64240 Len=0 MSS=1460 SACK_PERM=1
11$May 28, 2020 19:42:40.971350058 UTC$62$50:02:91:69:66:71$98:22:ef:d5:cc:2f$169.254.114.102$192.168.0.121$6$48$0$52995$80$[TCP Retransmission] 52995 → 80 [SYN] Seq=0 Win=2144 Len=0 MSS=536 SACK_PERM=1
12$May 28, 2020 19:42:40.971392004 UTC$62$98:22:ef:d5:cc:2f$06:8e:c3:81:b4:62$192.168.0.121$169.254.114.102$6$48$0$80$52995$[TCP Retransmission] 80 → 52995 [SYN, ACK] Seq=0 Ack=1 Win=64240 Len=0 MSS=1460 SACK_PERM=1
13$May 28, 2020 19:42:43.036773339 UTC$54$50:02:91:69:66:71$98:22:ef:d5:cc:2f$169.254.114.102$192.168.0.121$6$40$0$52995$80$[TCP ACKed unseen segment] 52995 → 80 [RST, ACK] Seq=1 Ack=563779768 Win=24584 Len=0
14$May 28, 2020 19:42:43.036883641 UTC$62$50:02:91:69:66:71$98:22:ef:d5:cc:2f$169.254.114.102$192.168.0.121$6$48$0$53513$80$53513 → 80 [SYN] Seq=0 Win=2144 Len=0 MSS=536 SACK_PERM=1
15$May 28, 2020 19:42:43.036932644 UTC$62$98:22:ef:d5:cc:2f$06:8e:c3:81:b4:62$192.168.0.121$169.254.114.102$6$48$0$80$53513$80 → 53513 [SYN, ACK] Seq=0 Ack=1 Win=64240 Len=0 MSS=1460 SACK_PERM=1
16$May 28, 2020 19:42:44.038492690 UTC$62$98:22:ef:d5:cc:2f$06:8e:c3:81:b4:62$192.168.0.121$169.254.114.102$6$48$0$80$53513$[TCP Retransmission] 80 → 53513 [SYN, ACK] Seq=0 Ack=1 Win=64240 Len=0 MSS=1460 SACK_PERM=1
17$May 28, 2020 19:42:44.678532879 UTC$62$98:22:ef:d5:cc:2f$06:8e:c3:81:b4:62$192.168.0.121$169.254.114.102$6$48$0$80$52218$80 → 52218 [SYN, ACK] Seq=0 Ack=1 Win=64240 Len=0 MSS=1460 SACK_PERM=1
18$May 28, 2020 19:42:45.194485654 UTC$62$98:22:ef:d5:cc:2f$06:8e:c3:81:b4:62$192.168.0.121$169.254.114.102$6$48$0$80$52995$[TCP Retransmission] 80 → 52995 [SYN, ACK] Seq=0 Ack=1 Win=64240 Len=0 MSS=1460 SACK_PERM=1
19$May 28, 2020 19:42:45.446482121 UTC$62$98:22:ef:d5:cc:2f$06:8e:c3:81:b4:62$192.168.0.121$169.254.114.102$6$48$0$80$54942$80 → 54942 [SYN, ACK] Seq=0 Ack=1 Win=64240 Len=0 MSS=1460 SACK_PERM=1
20$May 28, 2020 19:42:45.584328893 UTC$100$98:22:ef:d5:cc:2f$01:00:5e:00:00:fb$192.168.0.121$224.0.0.251$17$86$$$$Standard query response 0x0000 A, cache flush 192.168.0.121
21$May 28, 2020 19:42:45.584469668 UTC$100$98:22:ef:d5:cc:2f$01:00:5e:00:00:fb$192.168.0.121$224.0.0.251$17$86$$$$Standard query response 0x0000 A, cache flush 192.168.0.121
22$May 28, 2020 19:42:46.058477236 UTC$62$98:22:ef:d5:cc:2f$06:8e:c3:81:b4:62$192.168.0.121$169.254.114.102$6$48$0$80$53513$[TCP Retransmission] 80 → 53513 [SYN, ACK] Seq=0 Ack=1 Win=64240 Len=0 MSS=1460 SACK_PERM=1
23$May 28, 2020 19:42:46.063361840 UTC$62$50:02:91:69:66:71$98:22:ef:d5:cc:2f$169.254.114.102$192.168.0.121$6$48$0$53513$80$[TCP Retransmission] 53513 → 80 [SYN] Seq=0 Win=2144 Len=0 MSS=536 SACK_PERM=1
24$May 28, 2020 19:42:46.063401306 UTC$62$98:22:ef:d5:cc:2f$06:8e:c3:81:b4:62$192.168.0.121$169.254.114.102$6$48$0$80$53513$[TCP Retransmission] 80 → 53513 [SYN, ACK] Seq=0 Ack=1 Win=64240 Len=0 MSS=1460 SACK_PERM=1
25$May 28, 2020 19:42:46.715134127 UTC$66$06:8e:c3:81:b4:62$98:22:ef:d5:cc:2f$148.251.69.85$192.168.0.121$6$52$0$6568$44851$6568 → 44851 [ACK] Seq=1 Ack=1 Win=269 Len=0 TSval=3204777732 TSecr=2571365780
26$May 28, 2020 19:42:46.715169354 UTC$66$98:22:ef:d5:cc:2f$06:8e:c3:81:b4:62$192.168.0.121$148.251.69.85$6$52$0$44851$6568$[TCP ACKed unseen segment] 44851 → 6568 [ACK] Seq=1 Ack=2 Win=501 Len=0 TSval=2571376028 TSecr=3204746919
27$May 28, 2020 19:42:46.818569426 UTC$342$98:22:ef:d5:cc:2f$ff:ff:ff:ff:ff:ff$192.168.0.121$255.255.255.255$17$328$$$$DHCP Request  - Transaction ID 0xa028e754
28$May 28, 2020 19:42:48.262495612 UTC$62$98:22:ef:d5:cc:2f$06:8e:c3:81:b4:62$192.168.0.121$169.254.114.102$6$48$0$80$57712$[TCP Retransmission] [TCP Port numbers reused] 80 → 57712 [SYN, ACK] Seq=581384752 Ack=1 Win=64240 Len=0 MSS=1460 SACK_PERM=1
29$May 28, 2020 19:42:48.267495036 UTC$54$50:02:91:69:66:71$98:22:ef:d5:cc:2f$169.254.114.102$192.168.0.121$6$40$0$53513$80$[TCP ACKed unseen segment] 53513 → 80 [RST, ACK] Seq=1 Ack=843528570 Win=24584 Len=0
30$May 28, 2020 19:42:48.267583451 UTC$62$50:02:91:69:66:71$98:22:ef:d5:cc:2f$169.254.114.102$192.168.0.121$6$48$0$49970$80$49970 → 80 [SYN] Seq=0 Win=2144 Len=0 MSS=536 SACK_PERM=1
31$May 28, 2020 19:42:48.267629947 UTC$62$98:22:ef:d5:cc:2f$06:8e:c3:81:b4:62$192.168.0.121$169.254.114.102$6$48$0$80$49970$80 → 49970 [SYN, ACK] Seq=0 Ack=1 Win=64240 Len=0 MSS=1460 SACK_PERM=1
32$May 28, 2020 19:42:49.286502608 UTC$62$98:22:ef:d5:cc:2f$06:8e:c3:81:b4:62$192.168.0.121$169.254.114.102$6$48$0$80$49970$[TCP Retransmission] 80 → 49970 [SYN, ACK] Seq=0 Ack=1 Win=64240 Len=0 MSS=1460 SACK_PERM=1
33$May 28, 2020 19:42:50.310500631 UTC$62$98:22:ef:d5:cc:2f$06:8e:c3:81:b4:62$192.168.0.121$169.254.114.102$6$48$0$80$53513$[TCP Retransmission] 80 → 53513 [SYN, ACK] Seq=0 Ack=1 Win=64240 Len=0 MSS=1460 SACK_PERM=1
34$May 28, 2020 19:42:50.566502145 UTC$62$98:22:ef:d5:cc:2f$06:8e:c3:81:b4:62$192.168.0.121$169.254.114.102$6$48$0$80$65142$80 → 65142 [SYN, ACK] Seq=0 Ack=1 Win=64240 Len=0 MSS=1460 SACK_PERM=1
35$May 28, 2020 19:42:50.584610152 UTC$100$98:22:ef:d5:cc:2f$01:00:5e:00:00:fb$192.168.0.121$224.0.0.251$17$86$$$$Standard query response 0x0000 A, cache flush 192.168.0.121
36$May 28, 2020 19:42:50.584810333 UTC$100$98:22:ef:d5:cc:2f$01:00:5e:00:00:fb$192.168.0.121$224.0.0.251$17$86$$$$Standard query response 0x0000 A, cache flush 192.168.0.121
37$May 28, 2020 19:42:51.007590635 UTC$62$50:02:91:69:66:71$98:22:ef:d5:cc:2f$169.254.114.102$192.168.0.121$6$48$0$49970$80$[TCP Retransmission] 49970 → 80 [SYN] Seq=0 Win=2144 Len=0 MSS=536 SACK_PERM=1
38$May 28, 2020 19:42:51.007630010 UTC$62$98:22:ef:d5:cc:2f$06:8e:c3:81:b4:62$192.168.0.121$169.254.114.102$6$48$0$80$49970$[TCP Retransmission] 80 → 49970 [SYN, ACK] Seq=0 Ack=1 Win=64240 Len=0 MSS=1460 SACK_PERM=1
39$May 28, 2020 19:42:51.825437067 UTC$42$06:8e:c3:81:b4:62$98:22:ef:d5:cc:2f$$$$$$$$Who has 192.168.0.121? Tell 192.168.0.1
40$May 28, 2020 19:42:51.825457397 UTC$42$98:22:ef:d5:cc:2f$06:8e:c3:81:b4:62$$$$$$$$192.168.0.121 is at 98:22:ef:d5:cc:2f
41$May 28, 2020 19:42:53.030494691 UTC$62$98:22:ef:d5:cc:2f$06:8e:c3:81:b4:62$192.168.0.121$169.254.114.102$6$48$0$80$49970$[TCP Retransmission] 80 → 49970 [SYN, ACK] Seq=0 Ack=1 Win=64240 Len=0 MSS=1460 SACK_PERM=1
42$May 28, 2020 19:42:53.382497473 UTC$62$98:22:ef:d5:cc:2f$06:8e:c3:81:b4:62$192.168.0.121$169.254.114.102$6$48$0$80$52995$[TCP Retransmission] 80 → 52995 [SYN, ACK] Seq=0 Ack=1 Win=64240 Len=0 MSS=1460 SACK_PERM=1
43$May 28, 2020 19:42:53.387369155 UTC$54$50:02:91:69:66:71$98:22:ef:d5:cc:2f$169.254.114.102$192.168.0.121$6$40$0$49970$80$49970 → 80 [RST, ACK] Seq=1 Ack=2722516016 Win=24584 Len=0
44$May 28, 2020 19:42:53.387467771 UTC$62$50:02:91:69:66:71$98:22:ef:d5:cc:2f$169.254.114.102$192.168.0.121$6$48$0$60729$80$60729 → 80 [SYN] Seq=0 Win=2144 Len=0 MSS=536 SACK_PERM=1
45$May 28, 2020 19:42:53.387510316 UTC$62$98:22:ef:d5:cc:2f$06:8e:c3:81:b4:62$192.168.0.121$169.254.114.102$6$48$0$80$60729$80 → 60729 [SYN, ACK] Seq=0 Ack=1 Win=64240 Len=0 MSS=1460 SACK_PERM=1
46$May 28, 2020 19:42:54.406483097 UTC$62$98:22:ef:d5:cc:2f$06:8e:c3:81:b4:62$192.168.0.121$169.254.114.102$6$48$0$80$60729$[TCP Retransmission] 80 → 60729 [SYN, ACK] Seq=0 Ack=1 Win=64240 Len=0 MSS=1460 SACK_PERM=1
47$May 28, 2020 19:42:55.584886808 UTC$100$98:22:ef:d5:cc:2f$01:00:5e:00:00:fb$192.168.0.121$224.0.0.251$17$86$$$$Standard query response 0x0000 A, cache flush 192.168.0.121
48$May 28, 2020 19:42:55.585081046 UTC$100$98:22:ef:d5:cc:2f$01:00:5e:00:00:fb$192.168.0.121$224.0.0.251$17$86$$$$Standard query response 0x0000 A, cache flush 192.168.0.121
49$May 28, 2020 19:42:55.807249533 UTC$342$98:22:ef:d5:cc:2f$ff:ff:ff:ff:ff:ff$192.168.0.121$255.255.255.255$17$328$$$$DHCP Request  - Transaction ID 0xa028e754
50$May 28, 2020 19:42:55.855528208 UTC$101$98:22:ef:d5:cc:2f$06:8e:c3:81:b4:62$192.168.0.121$100.21.160.37$6$87$35$60618$443$Application Data
51$May 28, 2020 19:42:55.882946174 UTC$97$98:22:ef:d5:cc:2f$06:8e:c3:81:b4:62$192.168.0.121$100.21.160.37$6$83$31$60618$443$Encrypted Alert
52$May 28, 2020 19:42:55.882977555 UTC$66$98:22:ef:d5:cc:2f$06:8e:c3:81:b4:62$192.168.0.121$100.21.160.37$6$52$0$60618$443$60618 → 443 [FIN, ACK] Seq=67 Ack=1 Win=501 Len=0 TSval=3392474535 TSecr=1942229828
53$May 28, 2020 19:42:56.118882849 UTC$62$50:02:91:69:66:71$98:22:ef:d5:cc:2f$169.254.114.102$192.168.0.121$6$48$0$60729$80$[TCP Retransmission] 60729 → 80 [SYN] Seq=0 Win=2144 Len=0 MSS=536 SACK_PERM=1
54$May 28, 2020 19:42:56.118914546 UTC$62$98:22:ef:d5:cc:2f$06:8e:c3:81:b4:62$192.168.0.121$169.254.114.102$6$48$0$80$60729$[TCP Retransmission] 80 → 60729 [SYN, ACK] Seq=0 Ack=1 Win=64240 Len=0 MSS=1460 SACK_PERM=1
55$May 28, 2020 19:42:56.198513061 UTC$62$98:22:ef:d5:cc:2f$06:8e:c3:81:b4:62$192.168.0.121$169.254.114.102$6$48$0$80$58595$[TCP Retransmission] 80 → 58595 [SYN, ACK] Seq=0 Ack=1 Win=64240 Len=0 MSS=1460 SACK_PERM=1
56$May 28, 2020 19:42:56.527902627 UTC$97$06:8e:c3:81:b4:62$98:22:ef:d5:cc:2f$100.21.160.37$192.168.0.121$6$83$31$443$60618$Application Data
57$May 28, 2020 19:42:56.527940302 UTC$54$98:22:ef:d5:cc:2f$06:8e:c3:81:b4:62$192.168.0.121$100.21.160.37$6$40$0$60618$443$60618 → 443 [RST] Seq=36 Win=0 Len=0
58$May 28, 2020 19:42:56.527952274 UTC$97$06:8e:c3:81:b4:62$98:22:ef:d5:cc:2f$100.21.160.37$192.168.0.121$6$83$31$443$60618$Encrypted Alert
59$May 28, 2020 19:42:56.527960465 UTC$54$98:22:ef:d5:cc:2f$06:8e:c3:81:b4:62$192.168.0.121$100.21.160.37$6$40$0$60618$443$60618 → 443 [RST] Seq=36 Win=0 Len=0
60$May 28, 2020 19:42:56.527964478 UTC$66$06:8e:c3:81:b4:62$98:22:ef:d5:cc:2f$100.21.160.37$192.168.0.121$6$52$0$443$60618$443 → 60618 [ACK] Seq=64 Ack=68 Win=118 Len=0 TSval=1942423103 TSecr=3392474535
61$May 28, 2020 19:42:56.527968648 UTC$54$98:22:ef:d5:cc:2f$06:8e:c3:81:b4:62$192.168.0.121$100.21.160.37$6$40$0$60618$443$60618 → 443 [RST] Seq=68 Win=0 Len=0
62$May 28, 2020 19:42:57.141421372 UTC$66$06:8e:c3:81:b4:62$98:22:ef:d5:cc:2f$148.251.69.85$192.168.0.121$6$52$0$6568$44851$[TCP Dup ACK 25#1] 6568 → 44851 [ACK] Seq=1 Ack=1 Win=269 Len=0 TSval=3204787960 TSecr=2571376028
63$May 28, 2020 19:42:57.141453908 UTC$66$98:22:ef:d5:cc:2f$06:8e:c3:81:b4:62$192.168.0.121$148.251.69.85$6$52$0$44851$6568$[TCP Dup ACK 26#1] [TCP ACKed unseen segment] 44851 → 6568 [ACK] Seq=1 Ack=2 Win=501 Len=0 TSval=2571386473 TSecr=3204746919
64$May 28, 2020 19:42:57.222490122 UTC$62$98:22:ef:d5:cc:2f$06:8e:c3:81:b4:62$192.168.0.121$169.254.114.102$6$48$0$80$49970$[TCP Retransmission] 80 → 49970 [SYN, ACK] Seq=0 Ack=1 Win=64240 Len=0 MSS=1460 SACK_PERM=1
65$May 28, 2020 19:42:58.154473893 UTC$62$98:22:ef:d5:cc:2f$06:8e:c3:81:b4:62$192.168.0.121$169.254.114.102$6$48$0$80$60729$[TCP Retransmission] 80 → 60729 [SYN, ACK] Seq=0 Ack=1 Win=64240 Len=0 MSS=1460 SACK_PERM=1
66$May 28, 2020 19:42:58.502479151 UTC$62$98:22:ef:d5:cc:2f$06:8e:c3:81:b4:62$192.168.0.121$169.254.114.102$6$48$0$80$53513$[TCP Retransmission] 80 → 53513 [SYN, ACK] Seq=0 Ack=1 Win=64240 Len=0 MSS=1460 SACK_PERM=1
67$May 28, 2020 19:42:58.507318617 UTC$54$50:02:91:69:66:71$98:22:ef:d5:cc:2f$169.254.114.102$192.168.0.121$6$40$0$60729$80$60729 → 80 [RST, ACK] Seq=1 Ack=2767478563 Win=24584 Len=0
68$May 28, 2020 19:42:58.507431370 UTC$62$50:02:91:69:66:71$98:22:ef:d5:cc:2f$169.254.114.102$192.168.0.121$6$48$0$64058$80$64058 → 80 [SYN] Seq=0 Win=2144 Len=0 MSS=536 SACK_PERM=1
69$May 28, 2020 19:42:58.507452441 UTC$62$98:22:ef:d5:cc:2f$06:8e:c3:81:b4:62$192.168.0.121$169.254.114.102$6$48$0$80$64058$80 → 64058 [SYN, ACK] Seq=0 Ack=1 Win=64240 Len=0 MSS=1460 SACK_PERM=1
70$May 28, 2020 19:42:59.526489525 UTC$62$98:22:ef:d5:cc:2f$06:8e:c3:81:b4:62$192.168.0.121$169.254.114.102$6$48$0$80$64058$[TCP Retransmission] 80 → 64058 [SYN, ACK] Seq=0 Ack=1 Win=64240 Len=0 MSS=1460 SACK_PERM=1
71$May 28, 2020 19:43:00.527219665 UTC$84$98:22:ef:d5:cc:2f$06:8e:c3:81:b4:62$192.168.0.121$192.168.0.1$17$70$$$$Standard query 0xfb59 A detectportal.firefox.com
72$May 28, 2020 19:43:00.530202135 UTC$84$98:22:ef:d5:cc:2f$06:8e:c3:81:b4:62$192.168.0.121$192.168.0.1$17$70$$$$Standard query 0xacde AAAA detectportal.firefox.com
73$May 28, 2020 19:43:00.585114986 UTC$100$98:22:ef:d5:cc:2f$01:00:5e:00:00:fb$192.168.0.121$224.0.0.251$17$86$$$$Standard query response 0x0000 A, cache flush 192.168.0.121
74$May 28, 2020 19:43:00.585271802 UTC$100$98:22:ef:d5:cc:2f$01:00:5e:00:00:fb$192.168.0.121$224.0.0.251$17$86$$$$Standard query response 0x0000 A, cache flush 192.168.0.121
75$May 28, 2020 19:43:00.600213981 UTC$266$06:8e:c3:81:b4:62$98:22:ef:d5:cc:2f$192.168.0.1$192.168.0.121$17$252$$$$Standard query response 0xacde AAAA detectportal.firefox.com CNAME detectportal.prod.mozaws.net CNAME detectportal.firefox.com-v2.edgesuite.net CNAME a1089.dscd.akamai.net AAAA 2405:200:160b:1731::312c:7319 AAAA 2405:200:160b:1731::312c:7308
76$May 28, 2020 19:43:00.609448799 UTC$242$06:8e:c3:81:b4:62$98:22:ef:d5:cc:2f$192.168.0.1$192.168.0.121$17$228$$$$Standard query response 0xfb59 A detectportal.firefox.com CNAME detectportal.prod.mozaws.net CNAME detectportal.firefox.com-v2.edgesuite.net CNAME a1089.dscd.akamai.net A 49.44.198.184 A 49.44.198.218
77$May 28, 2020 19:43:00.611755941 UTC$94$98:22:ef:d5:cc:2f$06:8e:c3:81:b4:62$$$$$0$56484$80$56484 → 80 [SYN] Seq=0 Win=64800 Len=0 MSS=1440 SACK_PERM=1 TSval=2823372739 TSecr=0 WS=128
78$May 28, 2020 19:43:00.670028781 UTC$94$06:8e:c3:81:b4:62$98:22:ef:d5:cc:2f$$$$$0$80$56484$80 → 56484 [SYN, ACK] Seq=0 Ack=1 Win=28560 Len=0 MSS=1370 SACK_PERM=1 TSval=416656246 TSecr=2823372739 WS=128
79$May 28, 2020 19:43:00.670060190 UTC$86$98:22:ef:d5:cc:2f$06:8e:c3:81:b4:62$$$$$0$56484$80$56484 → 80 [ACK] Seq=1 Ack=1 Win=64896 Len=0 TSval=2823372797 TSecr=416656246
80$May 28, 2020 19:43:00.670190393 UTC$382$98:22:ef:d5:cc:2f$06:8e:c3:81:b4:62$$$$$296$56484$80$GET /success.txt HTTP/1.1 
81$May 28, 2020 19:43:00.739666082 UTC$86$06:8e:c3:81:b4:62$98:22:ef:d5:cc:2f$$$$$0$80$56484$80 → 56484 [ACK] Seq=1 Ack=297 Win=29696 Len=0 TSval=416656316 TSecr=2823372797
82$May 28, 2020 19:43:00.739695276 UTC$470$06:8e:c3:81:b4:62$98:22:ef:d5:cc:2f$$$$$384$80$56484$HTTP/1.1 200 OK  (text/plain)
83$May 28, 2020 19:43:00.739713354 UTC$86$98:22:ef:d5:cc:2f$06:8e:c3:81:b4:62$$$$$0$56484$80$56484 → 80 [ACK] Seq=297 Ack=385 Win=64512 Len=0 TSval=2823372867 TSecr=416656317
84$May 28, 2020 19:43:00.806482195 UTC$66$98:22:ef:d5:cc:2f$06:8e:c3:81:b4:62$192.168.0.121$148.251.69.85$6$52$0$44851$6568$[TCP Keep-Alive] [TCP ACKed unseen segment] 44851 → 6568 [ACK] Seq=0 Ack=2 Win=501 Len=0 TSval=2571390144 TSecr=3204746919
85$May 28, 2020 19:43:00.806541049 UTC$62$98:22:ef:d5:cc:2f$06:8e:c3:81:b4:62$192.168.0.121$169.254.114.102$6$48$0$80$52218$[TCP Retransmission] 80 → 52218 [SYN, ACK] Seq=0 Ack=1 Win=64240 Len=0 MSS=1460 SACK_PERM=1
86$May 28, 2020 19:43:00.915811612 UTC$71$98:22:ef:d5:cc:2f$06:8e:c3:81:b4:62$192.168.0.121$192.168.0.1$17$57$$$$Standard query 0xe1cd A mozilla.org
87$May 28, 2020 19:43:00.915991708 UTC$71$98:22:ef:d5:cc:2f$06:8e:c3:81:b4:62$192.168.0.121$192.168.0.1$17$57$$$$Standard query 0x962e AAAA mozilla.org
88$May 28, 2020 19:43:00.916019074 UTC$74$98:22:ef:d5:cc:2f$06:8e:c3:81:b4:62$192.168.0.121$49.44.198.218$6$60$0$44240$80$44240 → 80 [SYN] Seq=0 Win=64240 Len=0 MSS=1460 SACK_PERM=1 TSval=387791613 TSecr=0 WS=128
89$May 28, 2020 19:43:00.916214893 UTC$94$98:22:ef:d5:cc:2f$06:8e:c3:81:b4:62$$$$$0$56518$80$56518 → 80 [SYN] Seq=0 Win=64800 Len=0 MSS=1440 SACK_PERM=1 TSval=2823373043 TSecr=0 WS=128
90$May 28, 2020 19:43:00.969643660 UTC$94$06:8e:c3:81:b4:62$98:22:ef:d5:cc:2f$$$$$0$80$56518$80 → 56518 [SYN, ACK] Seq=0 Ack=1 Win=28560 Len=0 MSS=1370 SACK_PERM=1 TSval=416656546 TSecr=2823373043 WS=128
91$May 28, 2020 19:43:00.969678166 UTC$86$98:22:ef:d5:cc:2f$06:8e:c3:81:b4:62$$$$$0$56518$80$56518 → 80 [ACK] Seq=1 Ack=1 Win=64896 Len=0 TSval=2823373097 TSecr=416656546
92$May 28, 2020 19:43:00.969795905 UTC$387$98:22:ef:d5:cc:2f$06:8e:c3:81:b4:62$$$$$301$56518$80$GET /success.txt?ipv6 HTTP/1.1 
93$May 28, 2020 19:43:00.971523365 UTC$74$06:8e:c3:81:b4:62$98:22:ef:d5:cc:2f$49.44.198.218$192.168.0.121$6$60$0$80$44240$80 → 44240 [SYN, ACK] Seq=0 Ack=1 Win=28960 Len=0 MSS=1370 SACK_PERM=1 TSval=2729343584 TSecr=387791613 WS=128
94$May 28, 2020 19:43:00.971553824 UTC$66$98:22:ef:d5:cc:2f$06:8e:c3:81:b4:62$192.168.0.121$49.44.198.218$6$52$0$44240$80$44240 → 80 [ACK] Seq=1 Ack=1 Win=64256 Len=0 TSval=387791669 TSecr=2729343584
95$May 28, 2020 19:43:00.971641034 UTC$367$98:22:ef:d5:cc:2f$06:8e:c3:81:b4:62$192.168.0.121$49.44.198.218$6$353$301$44240$80$GET /success.txt?ipv4 HTTP/1.1 
96$May 28, 2020 19:43:00.979030187 UTC$87$06:8e:c3:81:b4:62$98:22:ef:d5:cc:2f$192.168.0.1$192.168.0.121$17$73$$$$Standard query response 0xe1cd A mozilla.org A 63.245.208.195
97$May 28, 2020 19:43:00.980136608 UTC$151$06:8e:c3:81:b4:62$98:22:ef:d5:cc:2f$192.168.0.1$192.168.0.121$17$137$$$$Standard query response 0x962e AAAA mozilla.org SOA infoblox1.private.mdc2.mozilla.com
98$May 28, 2020 19:43:00.997338372 UTC$66$06:8e:c3:81:b4:62$98:22:ef:d5:cc:2f$148.251.69.85$192.168.0.121$6$52$0$6568$44851$[TCP Previous segment not captured] 6568 → 44851 [ACK] Seq=2 Ack=1 Win=269 Len=0 TSval=3204792069 TSecr=2571386473
99$May 28, 2020 19:43:01.040521048 UTC$86$06:8e:c3:81:b4:62$98:22:ef:d5:cc:2f$$$$$0$80$56518$80 → 56518 [ACK] Seq=1 Ack=302 Win=29696 Len=0 TSval=416656616 TSecr=2823373097
100$May 28, 2020 19:43:01.040549003 UTC$66$06:8e:c3:81:b4:62$98:22:ef:d5:cc:2f$49.44.198.218$192.168.0.121$6$52$0$80$44240$80 → 44240 [ACK] Seq=1 Ack=302 Win=30080 Len=0 TSval=2729343654 TSecr=387791669
101$May 28, 2020 19:43:01.040559898 UTC$450$06:8e:c3:81:b4:62$98:22:ef:d5:cc:2f$49.44.198.218$192.168.0.121$6$436$384$80$44240$HTTP/1.1 200 OK  (text/plain)
102$May 28, 2020 19:43:01.040570112 UTC$66$98:22:ef:d5:cc:2f$06:8e:c3:81:b4:62$192.168.0.121$49.44.198.218$6$52$0$44240$80$44240 → 80 [ACK] Seq=302 Ack=385 Win=64128 Len=0 TSval=387791738 TSecr=2729343655
103$May 28, 2020 19:43:01.040578870 UTC$470$06:8e:c3:81:b4:62$98:22:ef:d5:cc:2f$$$$$384$80$56518$HTTP/1.1 200 OK  (text/plain)
104$May 28, 2020 19:43:01.040587725 UTC$86$98:22:ef:d5:cc:2f$06:8e:c3:81:b4:62$$$$$0$56518$80$56518 → 80 [ACK] Seq=302 Ack=385 Win=64512 Len=0 TSval=2823373168 TSecr=416656617
105$May 28, 2020 19:43:01.325207629 UTC$97$98:22:ef:d5:cc:2f$06:8e:c3:81:b4:62$192.168.0.121$192.168.0.1$17$83$$$$Standard query 0x4858 A firefox.settings.services.mozilla.com
106$May 28, 2020 19:43:01.327999161 UTC$97$98:22:ef:d5:cc:2f$06:8e:c3:81:b4:62$192.168.0.121$192.168.0.1$17$83$$$$Standard query 0x4a04 AAAA firefox.settings.services.mozilla.com
107$May 28, 2020 19:43:01.333055426 UTC$62$50:02:91:69:66:71$98:22:ef:d5:cc:2f$169.254.114.102$192.168.0.121$6$48$0$64058$80$[TCP Retransmission] 64058 → 80 [SYN] Seq=0 Win=2144 Len=0 MSS=536 SACK_PERM=1
108$May 28, 2020 19:43:01.333095134 UTC$62$98:22:ef:d5:cc:2f$06:8e:c3:81:b4:62$192.168.0.121$169.254.114.102$6$48$0$80$64058$[TCP Retransmission] 80 → 64058 [SYN, ACK] Seq=0 Ack=1 Win=64240 Len=0 MSS=1460 SACK_PERM=1
109$May 28, 2020 19:43:01.370748982 UTC$89$98:22:ef:d5:cc:2f$06:8e:c3:81:b4:62$192.168.0.121$192.168.0.1$17$75$$$$Standard query 0x97cf A d2nxq2uap88usk.cloudfront.net
110$May 28, 2020 19:43:01.370974109 UTC$89$98:22:ef:d5:cc:2f$06:8e:c3:81:b4:62$192.168.0.121$192.168.0.1$17$75$$$$Standard query 0x0610 AAAA d2nxq2uap88usk.cloudfront.net
111$May 28, 2020 19:43:01.398120622 UTC$181$06:8e:c3:81:b4:62$98:22:ef:d5:cc:2f$192.168.0.1$192.168.0.121$17$167$$$$Standard query response 0x4a04 AAAA firefox.settings.services.mozilla.com SOA ns-1627.awsdns-11.co.uk
112$May 28, 2020 19:43:01.407723798 UTC$161$06:8e:c3:81:b4:62$98:22:ef:d5:cc:2f$192.168.0.1$192.168.0.121$17$147$$$$Standard query response 0x4858 A firefox.settings.services.mozilla.com A 13.227.185.76 A 13.227.185.86 A 13.227.185.15 A 13.227.185.57
113$May 28, 2020 19:43:01.408242683 UTC$74$98:22:ef:d5:cc:2f$06:8e:c3:81:b4:62$192.168.0.121$13.227.185.76$6$60$0$45286$443$45286 → 443 [SYN] Seq=0 Win=64240 Len=0 MSS=1460 SACK_PERM=1 TSval=105999413 TSecr=0 WS=128
114$May 28, 2020 19:43:01.413121337 UTC$313$06:8e:c3:81:b4:62$98:22:ef:d5:cc:2f$192.168.0.1$192.168.0.121$17$299$$$$Standard query response 0x0610 AAAA d2nxq2uap88usk.cloudfront.net AAAA 2600:9000:21c8:6800:a:da5e:7900:93a1 AAAA 2600:9000:21c8:a800:a:da5e:7900:93a1 AAAA 2600:9000:21c8:6c00:a:da5e:7900:93a1 AAAA 2600:9000:21c8:e00:a:da5e:7900:93a1 AAAA 2600:9000:21c8:4c00:a:da5e:7900:93a1 AAAA 2600:9000:21c8:f800:a:da5e:7900:93a1 AAAA 2600:9000:21c8:4400:a:da5e:7900:93a1 AAAA 2600:9000:21c8:cc00:a:da5e:7900:93a1
115$May 28, 2020 19:43:01.413245625 UTC$153$06:8e:c3:81:b4:62$98:22:ef:d5:cc:2f$192.168.0.1$192.168.0.121$17$139$$$$Standard query response 0x97cf A d2nxq2uap88usk.cloudfront.net A 13.227.237.20 A 13.227.237.82 A 13.227.237.28 A 13.227.237.114
116$May 28, 2020 19:43:01.413670193 UTC$94$98:22:ef:d5:cc:2f$06:8e:c3:81:b4:62$$$$$0$53026$443$53026 → 443 [SYN] Seq=0 Win=64800 Len=0 MSS=1440 SACK_PERM=1 TSval=712903165 TSecr=0 WS=128
117$May 28, 2020 19:43:01.456145772 UTC$84$98:22:ef:d5:cc:2f$06:8e:c3:81:b4:62$192.168.0.121$192.168.0.1$17$70$$$$Standard query 0xa754 A autopush.prod.mozaws.net
118$May 28, 2020 19:43:01.456313633 UTC$84$98:22:ef:d5:cc:2f$06:8e:c3:81:b4:62$192.168.0.121$192.168.0.1$17$70$$$$Standard query 0xdf5d AAAA autopush.prod.mozaws.net
119$May 28, 2020 19:43:01.483690028 UTC$74$06:8e:c3:81:b4:62$98:22:ef:d5:cc:2f$13.227.185.76$192.168.0.121$6$60$0$443$45286$443 → 45286 [SYN, ACK] Seq=0 Ack=1 Win=28960 Len=0 MSS=1370 SACK_PERM=1 TSval=272356015 TSecr=105999413 WS=256
120$May 28, 2020 19:43:01.483738532 UTC$66$98:22:ef:d5:cc:2f$06:8e:c3:81:b4:62$192.168.0.121$13.227.185.76$6$52$0$45286$443$45286 → 443 [ACK] Seq=1 Ack=1 Win=64256 Len=0 TSval=105999489 TSecr=272356015
121$May 28, 2020 19:43:01.485227378 UTC$583$98:22:ef:d5:cc:2f$06:8e:c3:81:b4:62$192.168.0.121$13.227.185.76$6$569$517$45286$443$Client Hello
122$May 28, 2020 19:43:01.485615689 UTC$94$06:8e:c3:81:b4:62$98:22:ef:d5:cc:2f$$$$$0$443$53026$443 → 53026 [SYN, ACK] Seq=0 Ack=1 Win=24160 Len=0 MSS=1220 SACK_PERM=1 TSval=170819986 TSecr=712903165 WS=256
123$May 28, 2020 19:43:01.485653485 UTC$86$98:22:ef:d5:cc:2f$06:8e:c3:81:b4:62$$$$$0$53026$443$53026 → 443 [ACK] Seq=1 Ack=1 Win=64896 Len=0 TSval=712903237 TSecr=170819986
124$May 28, 2020 19:43:01.486782957 UTC$603$98:22:ef:d5:cc:2f$06:8e:c3:81:b4:62$$$$$517$53026$443$Client Hello
125$May 28, 2020 19:43:01.507871210 UTC$100$06:8e:c3:81:b4:62$98:22:ef:d5:cc:2f$192.168.0.1$192.168.0.121$17$86$$$$Standard query response 0xa754 A autopush.prod.mozaws.net A 52.26.190.215
126$May 28, 2020 19:43:01.518847184 UTC$169$06:8e:c3:81:b4:62$98:22:ef:d5:cc:2f$192.168.0.1$192.168.0.121$17$155$$$$Standard query response 0xdf5d AAAA autopush.prod.mozaws.net SOA ns-1260.awsdns-29.org
127$May 28, 2020 19:43:01.527760397 UTC$74$98:22:ef:d5:cc:2f$06:8e:c3:81:b4:62$192.168.0.121$52.26.190.215$6$60$0$37206$443$37206 → 443 [SYN] Seq=0 Win=64240 Len=0 MSS=1460 SACK_PERM=1 TSval=4221393718 TSecr=0 WS=128
128$May 28, 2020 19:43:01.571395154 UTC$66$06:8e:c3:81:b4:62$98:22:ef:d5:cc:2f$13.227.185.76$192.168.0.121$6$52$0$443$45286$443 → 45286 [ACK] Seq=1 Ack=518 Win=30208 Len=0 TSval=272356024 TSecr=105999490
129$May 28, 2020 19:43:01.571412161 UTC$1424$06:8e:c3:81:b4:62$98:22:ef:d5:cc:2f$13.227.185.76$192.168.0.121$6$1410$1358$443$45286$Server Hello
130$May 28, 2020 19:43:01.571420610 UTC$66$98:22:ef:d5:cc:2f$06:8e:c3:81:b4:62$192.168.0.121$13.227.185.76$6$52$0$45286$443$45286 → 443 [ACK] Seq=518 Ack=1359 Win=64128 Len=0 TSval=105999577 TSecr=272356024
131$May 28, 2020 19:43:01.574473753 UTC$1424$06:8e:c3:81:b4:62$98:22:ef:d5:cc:2f$13.227.185.76$192.168.0.121$6$1410$1358$443$45286$443 → 45286 [ACK] Seq=1359 Ack=518 Win=30208 Len=1358 TSval=272356024 TSecr=105999490 [TCP segment of a reassembled PDU]
132$May 28, 2020 19:43:01.574495146 UTC$66$98:22:ef:d5:cc:2f$06:8e:c3:81:b4:62$192.168.0.121$13.227.185.76$6$52$0$45286$443$45286 → 443 [ACK] Seq=518 Ack=2717 Win=64128 Len=0 TSval=105999580 TSecr=272356024
133$May 28, 2020 19:43:01.577363214 UTC$86$06:8e:c3:81:b4:62$98:22:ef:d5:cc:2f$$$$$0$443$53026$443 → 53026 [ACK] Seq=1 Ack=518 Win=25344 Len=0 TSval=170819995 TSecr=712903238
134$May 28, 2020 19:43:01.577384055 UTC$1254$06:8e:c3:81:b4:62$98:22:ef:d5:cc:2f$13.227.185.76$192.168.0.121$6$1240$1188$443$45286$Certificate, Certificate Status, Server Key Exchange, Server Hello Done
135$May 28, 2020 19:43:01.577394773 UTC$66$98:22:ef:d5:cc:2f$06:8e:c3:81:b4:62$192.168.0.121$13.227.185.76$6$52$0$45286$443$45286 → 443 [ACK] Seq=518 Ack=3905 Win=64128 Len=0 TSval=105999583 TSecr=272356024
136$May 28, 2020 19:43:01.577405598 UTC$1294$06:8e:c3:81:b4:62$98:22:ef:d5:cc:2f$$$$$1208$443$53026$Server Hello
137$May 28, 2020 19:43:01.577416097 UTC$86$98:22:ef:d5:cc:2f$06:8e:c3:81:b4:62$$$$$0$53026$443$53026 → 443 [ACK] Seq=518 Ack=1209 Win=64128 Len=0 TSval=712903329 TSecr=170819995
138$May 28, 2020 19:43:01.578687898 UTC$1294$06:8e:c3:81:b4:62$98:22:ef:d5:cc:2f$$$$$1208$443$53026$443 → 53026 [ACK] Seq=1209 Ack=518 Win=25344 Len=1208 TSval=170819995 TSecr=712903238 [TCP segment of a reassembled PDU]
139$May 28, 2020 19:43:01.578715910 UTC$86$98:22:ef:d5:cc:2f$06:8e:c3:81:b4:62$$$$$0$53026$443$53026 → 443 [ACK] Seq=518 Ack=2417 Win=63104 Len=0 TSval=712903330 TSecr=170819995
140$May 28, 2020 19:43:01.581128187 UTC$1436$06:8e:c3:81:b4:62$98:22:ef:d5:cc:2f$$$$$1350$443$53026$Certificate, Certificate Status, Server Key Exchange, Server Hello Done
141$May 28, 2020 19:43:01.581155996 UTC$86$98:22:ef:d5:cc:2f$06:8e:c3:81:b4:62$$$$$0$53026$443$53026 → 443 [ACK] Seq=518 Ack=3767 Win=61824 Len=0 TSval=712903332 TSecr=170819995
142$May 28, 2020 19:43:01.581663667 UTC$192$98:22:ef:d5:cc:2f$06:8e:c3:81:b4:62$192.168.0.121$13.227.185.76$6$178$126$45286$443$Client Key Exchange, Change Cipher Spec, Encrypted Handshake Message
143$May 28, 2020 19:43:01.587291888 UTC$212$98:22:ef:d5:cc:2f$06:8e:c3:81:b4:62$$$$$126$53026$443$Client Key Exchange, Change Cipher Spec, Encrypted Handshake Message
144$May 28, 2020 19:43:01.651128993 UTC$66$06:8e:c3:81:b4:62$98:22:ef:d5:cc:2f$13.227.185.76$192.168.0.121$6$52$0$443$45286$443 → 45286 [ACK] Seq=3905 Ack=644 Win=30208 Len=0 TSval=272356032 TSecr=105999587
145$May 28, 2020 19:43:01.651147963 UTC$236$06:8e:c3:81:b4:62$98:22:ef:d5:cc:2f$13.227.185.76$192.168.0.121$6$222$170$443$45286$New Session Ticket, Change Cipher Spec, Encrypted Handshake Message
146$May 28, 2020 19:43:01.658941160 UTC$86$06:8e:c3:81:b4:62$98:22:ef:d5:cc:2f$$$$$0$443$53026$443 → 53026 [ACK] Seq=3767 Ack=644 Win=25344 Len=0 TSval=170820003 TSecr=712903338
147$May 28, 2020 19:43:01.658960737 UTC$256$06:8e:c3:81:b4:62$98:22:ef:d5:cc:2f$$$$$170$443$53026$New Session Ticket, Change Cipher Spec, Encrypted Handshake Message
148$May 28, 2020 19:43:01.658965818 UTC$155$06:8e:c3:81:b4:62$98:22:ef:d5:cc:2f$$$$$69$443$53026$Application Data
149$May 28, 2020 19:43:01.698496056 UTC$66$98:22:ef:d5:cc:2f$06:8e:c3:81:b4:62$192.168.0.121$13.227.185.76$6$52$0$45286$443$45286 → 443 [ACK] Seq=644 Ack=4075 Win=64128 Len=0 TSval=105999704 TSecr=272356032
150$May 28, 2020 19:43:01.702497759 UTC$86$98:22:ef:d5:cc:2f$06:8e:c3:81:b4:62$$$$$0$53026$443$53026 → 443 [ACK] Seq=644 Ack=4006 Win=64128 Len=0 TSval=712903454 TSecr=170820003
151$May 28, 2020 19:43:01.773790841 UTC$263$98:22:ef:d5:cc:2f$06:8e:c3:81:b4:62$$$$$177$53026$443$Application Data
152$May 28, 2020 19:43:01.774553080 UTC$438$98:22:ef:d5:cc:2f$06:8e:c3:81:b4:62$192.168.0.121$13.227.185.76$6$424$372$45286$443$Application Data
153$May 28, 2020 19:43:01.775729378 UTC$370$98:22:ef:d5:cc:2f$06:8e:c3:81:b4:62$$$$$284$53026$443$Application Data, Application Data
154$May 28, 2020 19:43:01.779452676 UTC$74$98:22:ef:d5:cc:2f$06:8e:c3:81:b4:62$192.168.0.121$52.26.190.215$6$60$0$37236$443$37236 → 443 [SYN] Seq=0 Win=64240 Len=0 MSS=1460 SACK_PERM=1 TSval=4221393970 TSecr=0 WS=128
155$May 28, 2020 19:43:01.848215984 UTC$74$06:8e:c3:81:b4:62$98:22:ef:d5:cc:2f$52.26.190.215$192.168.0.121$6$60$0$443$37206$443 → 37206 [SYN, ACK] Seq=0 Ack=1 Win=26847 Len=0 MSS=1370 SACK_PERM=1 TSval=544454288 TSecr=4221393718 WS=256
156$May 28, 2020 19:43:01.848287877 UTC$66$98:22:ef:d5:cc:2f$06:8e:c3:81:b4:62$192.168.0.121$52.26.190.215$6$52$0$37206$443$37206 → 443 [ACK] Seq=1 Ack=1 Win=64256 Len=0 TSval=4221394039 TSecr=544454288
157$May 28, 2020 19:43:01.852504808 UTC$887$06:8e:c3:81:b4:62$98:22:ef:d5:cc:2f$13.227.185.76$192.168.0.121$6$873$821$443$45286$Application Data
158$May 28, 2020 19:43:01.852555377 UTC$66$98:22:ef:d5:cc:2f$06:8e:c3:81:b4:62$192.168.0.121$13.227.185.76$6$52$0$45286$443$45286 → 443 [ACK] Seq=1016 Ack=4896 Win=64128 Len=0 TSval=105999858 TSecr=272356052
159$May 28, 2020 19:43:01.852583452 UTC$106$06:8e:c3:81:b4:62$98:22:ef:d5:cc:2f$13.227.185.76$192.168.0.121$6$92$40$443$45286$Application Data
160$May 28, 2020 19:43:01.852607752 UTC$66$98:22:ef:d5:cc:2f$06:8e:c3:81:b4:62$192.168.0.121$13.227.185.76$6$52$0$45286$443$45286 → 443 [ACK] Seq=1016 Ack=4936 Win=64128 Len=0 TSval=105999858 TSecr=272356052
161$May 28, 2020 19:43:01.853061802 UTC$583$98:22:ef:d5:cc:2f$06:8e:c3:81:b4:62$192.168.0.121$52.26.190.215$6$569$517$37206$443$Client Hello
162$May 28, 2020 19:43:01.855939560 UTC$124$06:8e:c3:81:b4:62$98:22:ef:d5:cc:2f$$$$$38$443$53026$Application Data
163$May 28, 2020 19:43:01.856010464 UTC$86$98:22:ef:d5:cc:2f$06:8e:c3:81:b4:62$$$$$0$53026$443$53026 → 443 [ACK] Seq=1105 Ack=4044 Win=64128 Len=0 TSval=712903608 TSecr=170820023
164$May 28, 2020 19:43:01.856033127 UTC$1294$06:8e:c3:81:b4:62$98:22:ef:d5:cc:2f$$$$$1208$443$53026$[TCP segment of a reassembled PDU]
165$May 28, 2020 19:43:01.856052302 UTC$86$98:22:ef:d5:cc:2f$06:8e:c3:81:b4:62$$$$$0$53026$443$53026 → 443 [ACK] Seq=1105 Ack=5252 Win=64128 Len=0 TSval=712903608 TSecr=170820023
166$May 28, 2020 19:43:01.857994050 UTC$1294$06:8e:c3:81:b4:62$98:22:ef:d5:cc:2f$$$$$1208$443$53026$443 → 53026 [ACK] Seq=5252 Ack=1105 Win=27392 Len=1208 TSval=170820023 TSecr=712903527 [TCP segment of a reassembled PDU]
167$May 28, 2020 19:43:01.858035353 UTC$86$98:22:ef:d5:cc:2f$06:8e:c3:81:b4:62$$$$$0$53026$443$53026 → 443 [ACK] Seq=1105 Ack=6460 Win=64128 Len=0 TSval=712903610 TSecr=170820023
168$May 28, 2020 19:43:01.861303956 UTC$1294$06:8e:c3:81:b4:62$98:22:ef:d5:cc:2f$$$$$1208$443$53026$443 → 53026 [ACK] Seq=6460 Ack=1105 Win=27392 Len=1208 TSval=170820023 TSecr=712903527 [TCP segment of a reassembled PDU]
169$May 28, 2020 19:43:01.861370089 UTC$86$98:22:ef:d5:cc:2f$06:8e:c3:81:b4:62$$$$$0$53026$443$53026 → 443 [ACK] Seq=1105 Ack=7668 Win=64128 Len=0 TSval=712903613 TSecr=170820023
170$May 28, 2020 19:43:01.862690383 UTC$2215$06:8e:c3:81:b4:62$98:22:ef:d5:cc:2f$$$$$2129$443$53026$Application Data, Application Data
171$May 28, 2020 19:43:01.862735659 UTC$86$98:22:ef:d5:cc:2f$06:8e:c3:81:b4:62$$$$$0$53026$443$53026 → 443 [ACK] Seq=1105 Ack=9797 Win=63104 Len=0 TSval=712903614 TSecr=170820023
172$May 28, 2020 19:43:01.891654694 UTC$90$98:22:ef:d5:cc:2f$06:8e:c3:81:b4:62$192.168.0.121$192.168.0.1$17$76$$$$Standard query 0x439c A incoming.telemetry.mozilla.org
173$May 28, 2020 19:43:01.891881434 UTC$90$98:22:ef:d5:cc:2f$06:8e:c3:81:b4:62$192.168.0.121$192.168.0.1$17$76$$$$Standard query 0x8943 AAAA incoming.telemetry.mozilla.org
174$May 28, 2020 19:43:01.945636642 UTC$465$98:22:ef:d5:cc:2f$06:8e:c3:81:b4:62$192.168.0.121$13.227.185.76$6$451$399$45286$443$Application Data
175$May 28, 2020 19:43:01.946488061 UTC$352$06:8e:c3:81:b4:62$98:22:ef:d5:cc:2f$192.168.0.1$192.168.0.121$17$338$$$$Standard query response 0x439c A incoming.telemetry.mozilla.org CNAME telemetry-incoming.r53-2.services.mozilla.com CNAME pipeline-incoming-prod-elb-149169523.us-west-2.elb.amazonaws.com A 52.37.165.213 A 44.231.216.202 A 52.39.105.52 A 52.34.254.140 A 52.43.41.214 A 52.26.194.242 A 52.88.91.154 A 52.39.14.40
176$May 28, 2020 19:43:01.956481054 UTC$302$06:8e:c3:81:b4:62$98:22:ef:d5:cc:2f$192.168.0.1$192.168.0.121$17$288$$$$Standard query response 0x8943 AAAA incoming.telemetry.mozilla.org CNAME telemetry-incoming.r53-2.services.mozilla.com CNAME pipeline-incoming-prod-elb-149169523.us-west-2.elb.amazonaws.com SOA ns-332.awsdns-41.com
177$May 28, 2020 19:43:01.956879442 UTC$124$98:22:ef:d5:cc:2f$06:8e:c3:81:b4:62$192.168.0.121$192.168.0.1$17$110$$$$Standard query 0x540c AAAA pipeline-incoming-prod-elb-149169523.us-west-2.elb.amazonaws.com
178$May 28, 2020 19:43:01.961016287 UTC$124$06:8e:c3:81:b4:62$98:22:ef:d5:cc:2f$192.168.0.1$192.168.0.121$17$110$$$$Standard query response 0x540c AAAA pipeline-incoming-prod-elb-149169523.us-west-2.elb.amazonaws.com
179$May 28, 2020 19:43:01.961397682 UTC$74$98:22:ef:d5:cc:2f$06:8e:c3:81:b4:62$192.168.0.121$52.39.14.40$6$60$0$38280$443$38280 → 443 [SYN] Seq=0 Win=64240 Len=0 MSS=1460 SACK_PERM=1 TSval=1124630239 TSecr=0 WS=128
180$May 28, 2020 19:43:02.022289345 UTC$881$06:8e:c3:81:b4:62$98:22:ef:d5:cc:2f$13.227.185.76$192.168.0.121$6$867$815$443$45286$Application Data
181$May 28, 2020 19:43:02.022355945 UTC$66$98:22:ef:d5:cc:2f$06:8e:c3:81:b4:62$192.168.0.121$13.227.185.76$6$52$0$45286$443$45286 → 443 [ACK] Seq=1415 Ack=5751 Win=64128 Len=0 TSval=106000028 TSecr=272356069
182$May 28, 2020 19:43:02.022375102 UTC$425$06:8e:c3:81:b4:62$98:22:ef:d5:cc:2f$13.227.185.76$192.168.0.121$6$411$359$443$45286$Application Data
183$May 28, 2020 19:43:02.022382117 UTC$66$98:22:ef:d5:cc:2f$06:8e:c3:81:b4:62$192.168.0.121$13.227.185.76$6$52$0$45286$443$45286 → 443 [ACK] Seq=1415 Ack=6110 Win=64128 Len=0 TSval=106000028 TSecr=272356069
184$May 28, 2020 19:43:02.056886705 UTC$74$98:22:ef:d5:cc:2f$06:8e:c3:81:b4:62$192.168.0.121$52.39.14.40$6$60$0$38296$443$38296 → 443 [SYN] Seq=0 Win=64240 Len=0 MSS=1460 SACK_PERM=1 TSval=1124630335 TSecr=0 WS=128
185$May 28, 2020 19:43:02.057396796 UTC$124$98:22:ef:d5:cc:2f$06:8e:c3:81:b4:62$192.168.0.121$192.168.0.1$17$110$$$$Standard query 0xf64e AAAA pipeline-incoming-prod-elb-149169523.us-west-2.elb.amazonaws.com
186$May 28, 2020 19:43:02.060765243 UTC$84$98:22:ef:d5:cc:2f$06:8e:c3:81:b4:62$192.168.0.121$192.168.0.1$17$70$$$$Standard query 0x292b A snippets.cdn.mozilla.net
187$May 28, 2020 19:43:02.060902635 UTC$84$98:22:ef:d5:cc:2f$06:8e:c3:81:b4:62$192.168.0.121$192.168.0.1$17$70$$$$Standard query 0x28eb AAAA snippets.cdn.mozilla.net
188$May 28, 2020 19:43:02.062341366 UTC$124$06:8e:c3:81:b4:62$98:22:ef:d5:cc:2f$192.168.0.1$192.168.0.121$17$110$$$$Standard query response 0xf64e AAAA pipeline-incoming-prod-elb-149169523.us-west-2.elb.amazonaws.com
189$May 28, 2020 19:43:02.122030238 UTC$205$06:8e:c3:81:b4:62$98:22:ef:d5:cc:2f$192.168.0.1$192.168.0.121$17$191$$$$Standard query response 0x28eb AAAA snippets.cdn.mozilla.net CNAME d228z91au11ukj.cloudfront.net SOA ns-889.awsdns-47.net
190$May 28, 2020 19:43:02.122277404 UTC$89$98:22:ef:d5:cc:2f$06:8e:c3:81:b4:62$192.168.0.121$192.168.0.1$17$75$$$$Standard query 0x7e01 AAAA d228z91au11ukj.cloudfront.net
191$May 28, 2020 19:43:02.123120504 UTC$188$06:8e:c3:81:b4:62$98:22:ef:d5:cc:2f$192.168.0.1$192.168.0.121$17$174$$$$Standard query response 0x292b A snippets.cdn.mozilla.net CNAME d228z91au11ukj.cloudfront.net A 13.227.185.66 A 13.227.185.51 A 13.227.185.52 A 13.227.185.18
192$May 28, 2020 19:43:02.123994538 UTC$74$06:8e:c3:81:b4:62$98:22:ef:d5:cc:2f$52.26.190.215$192.168.0.121$6$60$0$443$37236$443 → 37236 [SYN, ACK] Seq=0 Ack=1 Win=26847 Len=0 MSS=1370 SACK_PERM=1 TSval=544454540 TSecr=4221393970 WS=256
193$May 28, 2020 19:43:02.124012393 UTC$66$98:22:ef:d5:cc:2f$06:8e:c3:81:b4:62$192.168.0.121$52.26.190.215$6$52$0$37236$443$37236 → 443 [ACK] Seq=1 Ack=1 Win=64256 Len=0 TSval=4221394315 TSecr=544454540
194$May 28, 2020 19:43:02.125032432 UTC$583$98:22:ef:d5:cc:2f$06:8e:c3:81:b4:62$192.168.0.121$52.26.190.215$6$569$517$37236$443$Client Hello
195$May 28, 2020 19:43:02.129441792 UTC$89$06:8e:c3:81:b4:62$98:22:ef:d5:cc:2f$192.168.0.1$192.168.0.121$17$75$$$$Standard query response 0x7e01 AAAA d228z91au11ukj.cloudfront.net
196$May 28, 2020 19:43:02.129847259 UTC$74$98:22:ef:d5:cc:2f$06:8e:c3:81:b4:62$192.168.0.121$13.227.185.18$6$60$0$49648$443$49648 → 443 [SYN] Seq=0 Win=64240 Len=0 MSS=1460 SACK_PERM=1 TSval=1166052665 TSecr=0 WS=128
197$May 28, 2020 19:43:02.180052425 UTC$66$06:8e:c3:81:b4:62$98:22:ef:d5:cc:2f$52.26.190.215$192.168.0.121$6$52$0$443$37206$443 → 37206 [ACK] Seq=1 Ack=518 Win=28160 Len=0 TSval=544454623 TSecr=4221394044
198$May 28, 2020 19:43:02.181308401 UTC$1424$06:8e:c3:81:b4:62$98:22:ef:d5:cc:2f$52.26.190.215$192.168.0.121$6$1410$1358$443$37206$Server Hello
199$May 28, 2020 19:43:02.181328420 UTC$66$98:22:ef:d5:cc:2f$06:8e:c3:81:b4:62$192.168.0.121$52.26.190.215$6$52$0$37206$443$37206 → 443 [ACK] Seq=518 Ack=1359 Win=64128 Len=0 TSval=4221394372 TSecr=544454624
200$May 28, 2020 19:43:02.182613561 UTC$2126$06:8e:c3:81:b4:62$98:22:ef:d5:cc:2f$52.26.190.215$192.168.0.121$6$2112$2060$443$37206$Certificate, Server Key Exchange, Server Hello Done
201$May 28, 2020 19:43:02.182635143 UTC$66$98:22:ef:d5:cc:2f$06:8e:c3:81:b4:62$192.168.0.121$52.26.190.215$6$52$0$37206$443$37206 → 443 [ACK] Seq=518 Ack=3419 Win=63104 Len=0 TSval=4221394374 TSecr=544454624
202$May 28, 2020 19:43:02.184686318 UTC$77$98:22:ef:d5:cc:2f$06:8e:c3:81:b4:62$192.168.0.121$192.168.0.1$17$63$$$$Standard query 0xd5b3 A ocsp.digicert.com
203$May 28, 2020 19:43:02.184807505 UTC$77$98:22:ef:d5:cc:2f$06:8e:c3:81:b4:62$192.168.0.121$192.168.0.1$17$63$$$$Standard query 0x5807 AAAA ocsp.digicert.com
204$May 28, 2020 19:43:02.185120446 UTC$192$98:22:ef:d5:cc:2f$06:8e:c3:81:b4:62$192.168.0.121$52.26.190.215$6$178$126$37206$443$Client Key Exchange, Change Cipher Spec, Encrypted Handshake Message
205$May 28, 2020 19:43:02.188850450 UTC$125$06:8e:c3:81:b4:62$98:22:ef:d5:cc:2f$192.168.0.1$192.168.0.121$17$111$$$$Standard query response 0xd5b3 A ocsp.digicert.com CNAME cs9.wac.phicdn.net A 117.18.237.29
206$May 28, 2020 19:43:02.191539016 UTC$74$06:8e:c3:81:b4:62$98:22:ef:d5:cc:2f$13.227.185.18$192.168.0.121$6$60$0$443$49648$443 → 49648 [SYN, ACK] Seq=0 Ack=1 Win=28960 Len=0 MSS=1370 SACK_PERM=1 TSval=269477477 TSecr=1166052665 WS=256
